client_id	path	sentence	up_votes	down_votes	age	gender	accents	locale	segment
0b9ad5f732b88302440ae9dbb11e566885820579ea2e2016bfae84bc8c267a9164f58240fca1debfafebb3437bf891a84d608fa823d11299530b39c652f87dac	common_voice_ca_21328074.mp3	Per altra banda, al registre cadastral constava inscrita a nom de Barbany.	2	0	twenties	male	valencià	ca	
0b9ad5f732b88302440ae9dbb11e566885820579ea2e2016bfae84bc8c267a9164f58240fca1debfafebb3437bf891a84d608fa823d11299530b39c652f87dac	common_voice_ca_21328075.mp3	"Només es manté la façana principal de l'antic edifici."	2	0	twenties	male	valencià	ca	
0b9ad5f732b88302440ae9dbb11e566885820579ea2e2016bfae84bc8c267a9164f58240fca1debfafebb3437bf891a84d608fa823d11299530b39c652f87dac	common_voice_ca_21328076.mp3	Excel·lí com a superior dels convents reformats i mestre espirituals.	2	0	twenties	male	valencià	ca	
0b9ad5f732b88302440ae9dbb11e566885820579ea2e2016bfae84bc8c267a9164f58240fca1debfafebb3437bf891a84d608fa823d11299530b39c652f87dac	common_voice_ca_21328077.mp3	"Per aquestes raons, fent gala d'un gran menyspreu mutu."	2	0	twenties	male	valencià	ca	
0b9ad5f732b88302440ae9dbb11e566885820579ea2e2016bfae84bc8c267a9164f58240fca1debfafebb3437bf891a84d608fa823d11299530b39c652f87dac	common_voice_ca_21328129.mp3	"En general, es troba al costat de l'artèria quística."	2	0	twenties	male	valencià	ca	
0b9ad5f732b88302440ae9dbb11e566885820579ea2e2016bfae84bc8c267a9164f58240fca1debfafebb3437bf891a84d608fa823d11299530b39c652f87dac	common_voice_ca_21328130.mp3	"Es van proposar diverses missions per demostrar mètodes d'aterratge la nau espacial Gemini en terra."	2	1	twenties	male	valencià	ca	
0b9ad5f732b88302440ae9dbb11e566885820579ea2e2016bfae84bc8c267a9164f58240fca1debfafebb3437bf891a84d608fa823d11299530b39c652f87dac	common_voice_ca_21328131.mp3	"Ordre de les reparacions quan s'ha de realitzar diverses."	2	1	twenties	male	valencià	ca	
0b9ad5f732b88302440ae9dbb11e566885820579ea2e2016bfae84bc8c267a9164f58240fca1debfafebb3437bf891a84d608fa823d11299530b39c652f87dac	common_voice_ca_21328132.mp3	"A aquest programa s'hi ha afegit la donació de medicaments i instrumental mèdic."	2	1	twenties	male	valencià	ca	
0b9ad5f732b88302440ae9dbb11e566885820579ea2e2016bfae84bc8c267a9164f58240fca1debfafebb3437bf891a84d608fa823d11299530b39c652f87dac	common_voice_ca_21328133.mp3	Al seu torn, les lamel·les estan unides entre si per fibres col·làgenes.	2	1	twenties	male	valencià	ca	
0b9ad5f732b88302440ae9dbb11e566885820579ea2e2016bfae84bc8c267a9164f58240fca1debfafebb3437bf891a84d608fa823d11299530b39c652f87dac	common_voice_ca_21328143.mp3	"Flors rosades, floreix a finals de primavera i a l'estiu."	2	1	twenties	male	valencià	ca	
0b9ad5f732b88302440ae9dbb11e566885820579ea2e2016bfae84bc8c267a9164f58240fca1debfafebb3437bf891a84d608fa823d11299530b39c652f87dac	common_voice_ca_21328147.mp3	"Podia dictar bans per la Llei d'Ordre Públic."	2	0	twenties	male	valencià	ca	
0b9ad5f732b88302440ae9dbb11e566885820579ea2e2016bfae84bc8c267a9164f58240fca1debfafebb3437bf891a84d608fa823d11299530b39c652f87dac	common_voice_ca_21328148.mp3	"Com a conseqüència, l'església ortodoxa ara és la majoritària al país."	2	0	twenties	male	valencià	ca	
0b9ad5f732b88302440ae9dbb11e566885820579ea2e2016bfae84bc8c267a9164f58240fca1debfafebb3437bf891a84d608fa823d11299530b39c652f87dac	common_voice_ca_21328149.mp3	"Aquest fet va significar l'inici de la colonització romana del territori occità."	2	0	twenties	male	valencià	ca	
0b9ad5f732b88302440ae9dbb11e566885820579ea2e2016bfae84bc8c267a9164f58240fca1debfafebb3437bf891a84d608fa823d11299530b39c652f87dac	common_voice_ca_21328282.mp3	País amfitrió ressaltat.	2	1	twenties	male	valencià	ca	
0b9ad5f732b88302440ae9dbb11e566885820579ea2e2016bfae84bc8c267a9164f58240fca1debfafebb3437bf891a84d608fa823d11299530b39c652f87dac	common_voice_ca_21328289.mp3	"Es tracta d'un animal arborícola que s'alimenta de brots."	2	0	twenties	male	valencià	ca	
0b9ad5f732b88302440ae9dbb11e566885820579ea2e2016bfae84bc8c267a9164f58240fca1debfafebb3437bf891a84d608fa823d11299530b39c652f87dac	common_voice_ca_21328290.mp3	"És molt actiu a les xarxes on penja covers d'artistes."	2	0	twenties	male	valencià	ca	
0b9ad5f732b88302440ae9dbb11e566885820579ea2e2016bfae84bc8c267a9164f58240fca1debfafebb3437bf891a84d608fa823d11299530b39c652f87dac	common_voice_ca_21328291.mp3	Amb el temps es va anar reparant els danys però encara queden senyals.	2	0	twenties	male	valencià	ca	
0b9ad5f732b88302440ae9dbb11e566885820579ea2e2016bfae84bc8c267a9164f58240fca1debfafebb3437bf891a84d608fa823d11299530b39c652f87dac	common_voice_ca_21328300.mp3	"És endèmica del nord dels Andes peruans, prop de la frontera amb l'Equador."	2	1	twenties	male	valencià	ca	
0b9ad5f732b88302440ae9dbb11e566885820579ea2e2016bfae84bc8c267a9164f58240fca1debfafebb3437bf891a84d608fa823d11299530b39c652f87dac	common_voice_ca_21328301.mp3	El fort va quedar aviat en ruïnes.	2	0	twenties	male	valencià	ca	
0b9ad5f732b88302440ae9dbb11e566885820579ea2e2016bfae84bc8c267a9164f58240fca1debfafebb3437bf891a84d608fa823d11299530b39c652f87dac	common_voice_ca_21328303.mp3	Tots tres estats emeten monedes amb els símbols nacionals propis al revers.	2	0	twenties	male	valencià	ca	
0b9ad5f732b88302440ae9dbb11e566885820579ea2e2016bfae84bc8c267a9164f58240fca1debfafebb3437bf891a84d608fa823d11299530b39c652f87dac	common_voice_ca_21328306.mp3	"Aviat va obtenir prestigi per potenciar l'art innovador del moment."	2	1	twenties	male	valencià	ca	
11a464a6be72253dbf287fa8f2c9a8cf701965a19ef3c0d14013ea825d3d13f366063520fca54fc13b54a1201b9c8e1f7d69f6f321d1586e07d077e15cf87e01	common_voice_ca_20427432.mp3	Tanmateix, amb càlculs és possible determinar quin dels camins de sortida és el seleccionat.	2	0	twenties	female	central	ca	
11a464a6be72253dbf287fa8f2c9a8cf701965a19ef3c0d14013ea825d3d13f366063520fca54fc13b54a1201b9c8e1f7d69f6f321d1586e07d077e15cf87e01	common_voice_ca_20427438.mp3	La Carmeta caminava ben assossegada.	2	0	twenties	female	central	ca	
11a464a6be72253dbf287fa8f2c9a8cf701965a19ef3c0d14013ea825d3d13f366063520fca54fc13b54a1201b9c8e1f7d69f6f321d1586e07d077e15cf87e01	common_voice_ca_20427439.mp3	En retornar a Sant Petersburg, ben aviat fou promogut a càrrecs administratius de considerable importància.	2	0	twenties	female	central	ca	
11a464a6be72253dbf287fa8f2c9a8cf701965a19ef3c0d14013ea825d3d13f366063520fca54fc13b54a1201b9c8e1f7d69f6f321d1586e07d077e15cf87e01	common_voice_ca_20427440.mp3	És també autora de diversos treballs científics en el camp de la paleontologia.	2	0	twenties	female	central	ca	
11a464a6be72253dbf287fa8f2c9a8cf701965a19ef3c0d14013ea825d3d13f366063520fca54fc13b54a1201b9c8e1f7d69f6f321d1586e07d077e15cf87e01	common_voice_ca_20427441.mp3	Aquest fou discutit i esmenat pels participants al concili.	2	0	twenties	female	central	ca	
11a464a6be72253dbf287fa8f2c9a8cf701965a19ef3c0d14013ea825d3d13f366063520fca54fc13b54a1201b9c8e1f7d69f6f321d1586e07d077e15cf87e01	common_voice_ca_20427442.mp3	Hi ha molt pocs recursos naturals, i una absència gairebé total de la indústria.	2	0	twenties	female	central	ca	
11a464a6be72253dbf287fa8f2c9a8cf701965a19ef3c0d14013ea825d3d13f366063520fca54fc13b54a1201b9c8e1f7d69f6f321d1586e07d077e15cf87e01	common_voice_ca_20427448.mp3	La renda resultant és propietat del Tresor dels Estats Units.	2	0	twenties	female	central	ca	
11a464a6be72253dbf287fa8f2c9a8cf701965a19ef3c0d14013ea825d3d13f366063520fca54fc13b54a1201b9c8e1f7d69f6f321d1586e07d077e15cf87e01	common_voice_ca_20427449.mp3	Va formar part dels comtats de Foix i de Carcassona.	2	0	twenties	female	central	ca	
11a464a6be72253dbf287fa8f2c9a8cf701965a19ef3c0d14013ea825d3d13f366063520fca54fc13b54a1201b9c8e1f7d69f6f321d1586e07d077e15cf87e01	common_voice_ca_20427450.mp3	Aleshores ja només quedaven tres supervivents.	2	0	twenties	female	central	ca	
11a464a6be72253dbf287fa8f2c9a8cf701965a19ef3c0d14013ea825d3d13f366063520fca54fc13b54a1201b9c8e1f7d69f6f321d1586e07d077e15cf87e01	common_voice_ca_20427451.mp3	"Conjunt d'edificis d'un complex industrial."	2	0	twenties	female	central	ca	
11a464a6be72253dbf287fa8f2c9a8cf701965a19ef3c0d14013ea825d3d13f366063520fca54fc13b54a1201b9c8e1f7d69f6f321d1586e07d077e15cf87e01	common_voice_ca_20427452.mp3	"És la més septentrional del terme Morella i limita amb l'Aragó."	2	0	twenties	female	central	ca	
11a464a6be72253dbf287fa8f2c9a8cf701965a19ef3c0d14013ea825d3d13f366063520fca54fc13b54a1201b9c8e1f7d69f6f321d1586e07d077e15cf87e01	common_voice_ca_20427458.mp3	"L'eutrofització creixent de l'espai podria haver comportat la desaparició d'aquestes comunitats i espècies."	2	0	twenties	female	central	ca	
11a464a6be72253dbf287fa8f2c9a8cf701965a19ef3c0d14013ea825d3d13f366063520fca54fc13b54a1201b9c8e1f7d69f6f321d1586e07d077e15cf87e01	common_voice_ca_20427459.mp3	La figura de Maria destaca per ser més gran i de color vermell.	2	0	twenties	female	central	ca	
11a464a6be72253dbf287fa8f2c9a8cf701965a19ef3c0d14013ea825d3d13f366063520fca54fc13b54a1201b9c8e1f7d69f6f321d1586e07d077e15cf87e01	common_voice_ca_20427460.mp3	En un primer moment el tòxic es distribueix fins al lloc d’acció.	2	0	twenties	female	central	ca	
11a464a6be72253dbf287fa8f2c9a8cf701965a19ef3c0d14013ea825d3d13f366063520fca54fc13b54a1201b9c8e1f7d69f6f321d1586e07d077e15cf87e01	common_voice_ca_20427461.mp3	Forma part de les fronteres de Pennsilvània, Virgínia Occidental, Delaware i Maryland.	2	0	twenties	female	central	ca	
11a464a6be72253dbf287fa8f2c9a8cf701965a19ef3c0d14013ea825d3d13f366063520fca54fc13b54a1201b9c8e1f7d69f6f321d1586e07d077e15cf87e01	common_voice_ca_20427462.mp3	Damunt la porta i les finestres hi ha tres òculs.	2	0	twenties	female	central	ca	
11a464a6be72253dbf287fa8f2c9a8cf701965a19ef3c0d14013ea825d3d13f366063520fca54fc13b54a1201b9c8e1f7d69f6f321d1586e07d077e15cf87e01	common_voice_ca_20427473.mp3	En aquest cas es parla de dualitat mètrica.	2	0	twenties	female	central	ca	
11a464a6be72253dbf287fa8f2c9a8cf701965a19ef3c0d14013ea825d3d13f366063520fca54fc13b54a1201b9c8e1f7d69f6f321d1586e07d077e15cf87e01	common_voice_ca_20427474.mp3	"Floreix durant tot l'estiu, però per recol·lectar-la s'ha de fer a la primavera o tardor."	2	0	twenties	female	central	ca	
11a464a6be72253dbf287fa8f2c9a8cf701965a19ef3c0d14013ea825d3d13f366063520fca54fc13b54a1201b9c8e1f7d69f6f321d1586e07d077e15cf87e01	common_voice_ca_20427475.mp3	"És descendent d'alemanys del Volga i espanyols."	2	0	twenties	female	central	ca	
11a464a6be72253dbf287fa8f2c9a8cf701965a19ef3c0d14013ea825d3d13f366063520fca54fc13b54a1201b9c8e1f7d69f6f321d1586e07d077e15cf87e01	common_voice_ca_20427476.mp3	Anteriorment havia treballat de torner mecànic i delineant.	2	0	twenties	female	central	ca	
11a464a6be72253dbf287fa8f2c9a8cf701965a19ef3c0d14013ea825d3d13f366063520fca54fc13b54a1201b9c8e1f7d69f6f321d1586e07d077e15cf87e01	common_voice_ca_20427477.mp3	Professor convidat en diverses universitats, és col·laborador habitual de programes de ràdio i televisió.	2	0	twenties	female	central	ca	
13c5c4f0411a069e417ab8e6ba353f4b1c65da35f22a6fdbbdfd504cfae0dacf40b10b74f2c07c9375306d96241c29a7b483d10b2fac81d3cbfc3d43b27b5241	common_voice_ca_17473708.mp3	Horrible.	2	1	fourties	female	septentrional	ca	
13c5c4f0411a069e417ab8e6ba353f4b1c65da35f22a6fdbbdfd504cfae0dacf40b10b74f2c07c9375306d96241c29a7b483d10b2fac81d3cbfc3d43b27b5241	common_voice_ca_17473710.mp3	Adquireix els coneixements econòmics, comercials i socials que li permeten funcionar com a professional autònom.	2	0	fourties	female	septentrional	ca	
13c5c4f0411a069e417ab8e6ba353f4b1c65da35f22a6fdbbdfd504cfae0dacf40b10b74f2c07c9375306d96241c29a7b483d10b2fac81d3cbfc3d43b27b5241	common_voice_ca_17473711.mp3	Seguiu-me!	2	0	fourties	female	septentrional	ca	
13c5c4f0411a069e417ab8e6ba353f4b1c65da35f22a6fdbbdfd504cfae0dacf40b10b74f2c07c9375306d96241c29a7b483d10b2fac81d3cbfc3d43b27b5241	common_voice_ca_17473712.mp3	En cas de zones de pesca controlada que passen per dues o més comarques, hi figurarà un municipi per comarca.	2	1	fourties	female	septentrional	ca	
13c5c4f0411a069e417ab8e6ba353f4b1c65da35f22a6fdbbdfd504cfae0dacf40b10b74f2c07c9375306d96241c29a7b483d10b2fac81d3cbfc3d43b27b5241	common_voice_ca_17473724.mp3	Si ho feu pel vostre compte, envieu còpies de les vostres cartes a les organitzacions citades anteriorment.	2	0	fourties	female	septentrional	ca	
13c5c4f0411a069e417ab8e6ba353f4b1c65da35f22a6fdbbdfd504cfae0dacf40b10b74f2c07c9375306d96241c29a7b483d10b2fac81d3cbfc3d43b27b5241	common_voice_ca_17473726.mp3	Per Nadal, qui res no estrena, res no val.	2	0	fourties	female	septentrional	ca	
13c5c4f0411a069e417ab8e6ba353f4b1c65da35f22a6fdbbdfd504cfae0dacf40b10b74f2c07c9375306d96241c29a7b483d10b2fac81d3cbfc3d43b27b5241	common_voice_ca_17473728.mp3	"En l'actuació hi ha quatre masos."	2	0	fourties	female	septentrional	ca	
13c5c4f0411a069e417ab8e6ba353f4b1c65da35f22a6fdbbdfd504cfae0dacf40b10b74f2c07c9375306d96241c29a7b483d10b2fac81d3cbfc3d43b27b5241	common_voice_ca_17473730.mp3	Olla vella, bony o forat, o tot plegat.	2	0	fourties	female	septentrional	ca	
13c5c4f0411a069e417ab8e6ba353f4b1c65da35f22a6fdbbdfd504cfae0dacf40b10b74f2c07c9375306d96241c29a7b483d10b2fac81d3cbfc3d43b27b5241	common_voice_ca_17473732.mp3	"Abans d'instal·lar-lo llegiu-ne els requeriments de maquinari i programari."	2	1	fourties	female	septentrional	ca	
13c5c4f0411a069e417ab8e6ba353f4b1c65da35f22a6fdbbdfd504cfae0dacf40b10b74f2c07c9375306d96241c29a7b483d10b2fac81d3cbfc3d43b27b5241	common_voice_ca_17473748.mp3	Ximple!	2	0	fourties	female	septentrional	ca	
13c5c4f0411a069e417ab8e6ba353f4b1c65da35f22a6fdbbdfd504cfae0dacf40b10b74f2c07c9375306d96241c29a7b483d10b2fac81d3cbfc3d43b27b5241	common_voice_ca_17473749.mp3	Com esteu?	2	0	fourties	female	septentrional	ca	
13c5c4f0411a069e417ab8e6ba353f4b1c65da35f22a6fdbbdfd504cfae0dacf40b10b74f2c07c9375306d96241c29a7b483d10b2fac81d3cbfc3d43b27b5241	common_voice_ca_17473750.mp3	Estava nerviós.	2	0	fourties	female	septentrional	ca	
13c5c4f0411a069e417ab8e6ba353f4b1c65da35f22a6fdbbdfd504cfae0dacf40b10b74f2c07c9375306d96241c29a7b483d10b2fac81d3cbfc3d43b27b5241	common_voice_ca_17473751.mp3	La llengua és una matèria viva que construïm entre tots.	2	1	fourties	female	septentrional	ca	
13c5c4f0411a069e417ab8e6ba353f4b1c65da35f22a6fdbbdfd504cfae0dacf40b10b74f2c07c9375306d96241c29a7b483d10b2fac81d3cbfc3d43b27b5241	common_voice_ca_17473752.mp3	La resposta a aquestes necessitats poden ser les extensions.	2	0	fourties	female	septentrional	ca	
13c5c4f0411a069e417ab8e6ba353f4b1c65da35f22a6fdbbdfd504cfae0dacf40b10b74f2c07c9375306d96241c29a7b483d10b2fac81d3cbfc3d43b27b5241	common_voice_ca_19895039.mp3	Com totes les crucíferes sembla que el seu consum protegeix del càncer.	2	1	fourties	female	septentrional	ca	
13c5c4f0411a069e417ab8e6ba353f4b1c65da35f22a6fdbbdfd504cfae0dacf40b10b74f2c07c9375306d96241c29a7b483d10b2fac81d3cbfc3d43b27b5241	common_voice_ca_19895040.mp3	Durant aquest període el govern sud-coreà passa a controlar els mitjans públics de manera fèrria.	2	1	fourties	female	septentrional	ca	
13c5c4f0411a069e417ab8e6ba353f4b1c65da35f22a6fdbbdfd504cfae0dacf40b10b74f2c07c9375306d96241c29a7b483d10b2fac81d3cbfc3d43b27b5241	common_voice_ca_19895042.mp3	Les peces es van fer més fines i delicades.	3	0	fourties	female	septentrional	ca	
13c5c4f0411a069e417ab8e6ba353f4b1c65da35f22a6fdbbdfd504cfae0dacf40b10b74f2c07c9375306d96241c29a7b483d10b2fac81d3cbfc3d43b27b5241	common_voice_ca_19895043.mp3	Ell va ser un observador diligent i va publicar els seus en diverses transaccions científiques.	2	0	fourties	female	septentrional	ca	
13c5c4f0411a069e417ab8e6ba353f4b1c65da35f22a6fdbbdfd504cfae0dacf40b10b74f2c07c9375306d96241c29a7b483d10b2fac81d3cbfc3d43b27b5241	common_voice_ca_19895125.mp3	Està associada amb el Cercle Català de Negocis, una associació empresarial catalana.	3	0	fourties	female	septentrional	ca	
13c5c4f0411a069e417ab8e6ba353f4b1c65da35f22a6fdbbdfd504cfae0dacf40b10b74f2c07c9375306d96241c29a7b483d10b2fac81d3cbfc3d43b27b5241	common_voice_ca_19895127.mp3	La casa és propietat dels descendents directes dels Suquet, que ara tenen el cognom Costa.	2	1	fourties	female	septentrional	ca	
13c5c4f0411a069e417ab8e6ba353f4b1c65da35f22a6fdbbdfd504cfae0dacf40b10b74f2c07c9375306d96241c29a7b483d10b2fac81d3cbfc3d43b27b5241	common_voice_ca_19895128.mp3	És més sensible al fred que el bròquil però menys sensible a la calor.	2	0	fourties	female	septentrional	ca	
1586613271dd2083323d03f356bd6912735268eb070d599d4166538f613c28d7055012f507799afaef890eaa75a4041a67c68a5c2442db250f20df1abed8869a	common_voice_ca_21392794.mp3	És endèmic dels vessants septentrionals del Caucas, a Rússia.	2	0	teens	male	central	ca	
1586613271dd2083323d03f356bd6912735268eb070d599d4166538f613c28d7055012f507799afaef890eaa75a4041a67c68a5c2442db250f20df1abed8869a	common_voice_ca_21392795.mp3	Una superfície és carregada amb electricitat estàtica en forma uniforme.	2	0	teens	male	central	ca	
1586613271dd2083323d03f356bd6912735268eb070d599d4166538f613c28d7055012f507799afaef890eaa75a4041a67c68a5c2442db250f20df1abed8869a	common_voice_ca_21392796.mp3	El desistiment ha de ser total.	2	1	teens	male	central	ca	
1586613271dd2083323d03f356bd6912735268eb070d599d4166538f613c28d7055012f507799afaef890eaa75a4041a67c68a5c2442db250f20df1abed8869a	common_voice_ca_21392797.mp3	Els buits de les façanes estan emmarcats amb brancals i llinda plana de ceràmica.	2	0	teens	male	central	ca	
1586613271dd2083323d03f356bd6912735268eb070d599d4166538f613c28d7055012f507799afaef890eaa75a4041a67c68a5c2442db250f20df1abed8869a	common_voice_ca_21392798.mp3	"De manera inversa augmentant la superfície exposada augment l'intercanvi de calor."	2	0	teens	male	central	ca	
1586613271dd2083323d03f356bd6912735268eb070d599d4166538f613c28d7055012f507799afaef890eaa75a4041a67c68a5c2442db250f20df1abed8869a	common_voice_ca_21392801.mp3	Avui dia constitueix una de les atraccions turístiques del Iemen.	2	0	teens	male	central	ca	
1586613271dd2083323d03f356bd6912735268eb070d599d4166538f613c28d7055012f507799afaef890eaa75a4041a67c68a5c2442db250f20df1abed8869a	common_voice_ca_21392802.mp3	La mida i localització de la incisió depèn de la situació clínica.	2	0	teens	male	central	ca	
1586613271dd2083323d03f356bd6912735268eb070d599d4166538f613c28d7055012f507799afaef890eaa75a4041a67c68a5c2442db250f20df1abed8869a	common_voice_ca_21392803.mp3	La consciència mútua es va mantenir baixa i el coneixement ferm entre ells era limitat.	2	0	teens	male	central	ca	
1586613271dd2083323d03f356bd6912735268eb070d599d4166538f613c28d7055012f507799afaef890eaa75a4041a67c68a5c2442db250f20df1abed8869a	common_voice_ca_21399993.mp3	Es troba just on acaba la platja de Llevant i comença la Serra Gelada.	2	0	teens	male	central	ca	
1586613271dd2083323d03f356bd6912735268eb070d599d4166538f613c28d7055012f507799afaef890eaa75a4041a67c68a5c2442db250f20df1abed8869a	common_voice_ca_21399994.mp3	Va ser el compositor més destacat de la família Bach de la seva generació.	2	0	teens	male	central	ca	
1586613271dd2083323d03f356bd6912735268eb070d599d4166538f613c28d7055012f507799afaef890eaa75a4041a67c68a5c2442db250f20df1abed8869a	common_voice_ca_21399995.mp3	Altres classificacions, vistes a continuació, són: per escala, per relació funcional o per topologia.	2	0	teens	male	central	ca	
1586613271dd2083323d03f356bd6912735268eb070d599d4166538f613c28d7055012f507799afaef890eaa75a4041a67c68a5c2442db250f20df1abed8869a	common_voice_ca_21399997.mp3	El poble se situa al centre del terme municipal, a tocar del cap de municipi.	2	0	teens	male	central	ca	
1586613271dd2083323d03f356bd6912735268eb070d599d4166538f613c28d7055012f507799afaef890eaa75a4041a67c68a5c2442db250f20df1abed8869a	common_voice_ca_21477876.mp3	Va tenir males relacions amb Hitler i va arribar a condemnar el règim feixista.	2	0	teens	male	central	ca	
1586613271dd2083323d03f356bd6912735268eb070d599d4166538f613c28d7055012f507799afaef890eaa75a4041a67c68a5c2442db250f20df1abed8869a	common_voice_ca_21477877.mp3	Són tots homes vells rondinaires i dones.	2	1	teens	male	central	ca	
1586613271dd2083323d03f356bd6912735268eb070d599d4166538f613c28d7055012f507799afaef890eaa75a4041a67c68a5c2442db250f20df1abed8869a	common_voice_ca_21477879.mp3	En els individus adults, la medul·la vermella persisteix en els intersticis dels ossos esponjosos.	2	1	teens	male	central	ca	
1586613271dd2083323d03f356bd6912735268eb070d599d4166538f613c28d7055012f507799afaef890eaa75a4041a67c68a5c2442db250f20df1abed8869a	common_voice_ca_21477880.mp3	Va estudiar disseny gràfic.	2	0	teens	male	central	ca	
1586613271dd2083323d03f356bd6912735268eb070d599d4166538f613c28d7055012f507799afaef890eaa75a4041a67c68a5c2442db250f20df1abed8869a	common_voice_ca_21477891.mp3	"Jaume el Just va renunciar al regne per la pau d'Anagni."	2	0	teens	male	central	ca	
1586613271dd2083323d03f356bd6912735268eb070d599d4166538f613c28d7055012f507799afaef890eaa75a4041a67c68a5c2442db250f20df1abed8869a	common_voice_ca_21477892.mp3	"Aquest valor s'ha d'actualitzar per la variació anual."	2	0	teens	male	central	ca	
1586613271dd2083323d03f356bd6912735268eb070d599d4166538f613c28d7055012f507799afaef890eaa75a4041a67c68a5c2442db250f20df1abed8869a	common_voice_ca_21477893.mp3	"A l'edat mitjana, la vila canvia de nom després de l'edificació del castell pels ducs."	2	1	teens	male	central	ca	
1586613271dd2083323d03f356bd6912735268eb070d599d4166538f613c28d7055012f507799afaef890eaa75a4041a67c68a5c2442db250f20df1abed8869a	common_voice_ca_21477894.mp3	"El nombre d'alumnes ja havia augmentat."	2	0	teens	male	central	ca	
1586613271dd2083323d03f356bd6912735268eb070d599d4166538f613c28d7055012f507799afaef890eaa75a4041a67c68a5c2442db250f20df1abed8869a	common_voice_ca_21477895.mp3	"És un edifici entre mitgeres a l'angle del carrer medieval de Sant Cebrià de baix."	2	0	teens	male	central	ca	
1d487882a76e3930d7e4dbddcfe3051bff8e547c4c72f732598ccabed176e41ec52c2d46bcd0107177c47c61578e7202ccded0aecba74ae8e68076e133cfb090	common_voice_ca_20229867.mp3	Excepte en les primeres Cimeres, totes han girat sobre un tema.	2	0	sixties	male	nord-occidental	ca	
1d487882a76e3930d7e4dbddcfe3051bff8e547c4c72f732598ccabed176e41ec52c2d46bcd0107177c47c61578e7202ccded0aecba74ae8e68076e133cfb090	common_voice_ca_20229869.mp3	La informació fotogràfica és abundant.	2	0	sixties	male	nord-occidental	ca	
1d487882a76e3930d7e4dbddcfe3051bff8e547c4c72f732598ccabed176e41ec52c2d46bcd0107177c47c61578e7202ccded0aecba74ae8e68076e133cfb090	common_voice_ca_20229870.mp3	Hi estudià filosofia i teologia.	2	0	sixties	male	nord-occidental	ca	
1d487882a76e3930d7e4dbddcfe3051bff8e547c4c72f732598ccabed176e41ec52c2d46bcd0107177c47c61578e7202ccded0aecba74ae8e68076e133cfb090	common_voice_ca_20229871.mp3	"També hi havia l'ermita de Sant Llorenç."	2	0	sixties	male	nord-occidental	ca	
1d487882a76e3930d7e4dbddcfe3051bff8e547c4c72f732598ccabed176e41ec52c2d46bcd0107177c47c61578e7202ccded0aecba74ae8e68076e133cfb090	common_voice_ca_20229872.mp3	A les cruïlles dels camins se situaven unes placetes amb llocs de descans.	2	0	sixties	male	nord-occidental	ca	
1d487882a76e3930d7e4dbddcfe3051bff8e547c4c72f732598ccabed176e41ec52c2d46bcd0107177c47c61578e7202ccded0aecba74ae8e68076e133cfb090	common_voice_ca_20229937.mp3	Està vinculat culturalment al barri de Sant Andreu del Palomar de Barcelona.	2	1	sixties	male	nord-occidental	ca	
1d487882a76e3930d7e4dbddcfe3051bff8e547c4c72f732598ccabed176e41ec52c2d46bcd0107177c47c61578e7202ccded0aecba74ae8e68076e133cfb090	common_voice_ca_20229941.mp3	Els homes del seu batalló afirmaren que era un bon comandant.	2	0	sixties	male	nord-occidental	ca	
1d487882a76e3930d7e4dbddcfe3051bff8e547c4c72f732598ccabed176e41ec52c2d46bcd0107177c47c61578e7202ccded0aecba74ae8e68076e133cfb090	common_voice_ca_20229944.mp3	"Va presidir l'associació durant dotze anys i actualment n'és el president d'honor."	2	0	sixties	male	nord-occidental	ca	
1d487882a76e3930d7e4dbddcfe3051bff8e547c4c72f732598ccabed176e41ec52c2d46bcd0107177c47c61578e7202ccded0aecba74ae8e68076e133cfb090	common_voice_ca_20229945.mp3	Ell parla, però ella es comunica tota la pel·lícula amb llengua de signes.	2	0	sixties	male	nord-occidental	ca	
1d487882a76e3930d7e4dbddcfe3051bff8e547c4c72f732598ccabed176e41ec52c2d46bcd0107177c47c61578e7202ccded0aecba74ae8e68076e133cfb090	common_voice_ca_20229946.mp3	"Les basses estan molt amenaçades per l'expansió dels conreus."	2	0	sixties	male	nord-occidental	ca	
1d487882a76e3930d7e4dbddcfe3051bff8e547c4c72f732598ccabed176e41ec52c2d46bcd0107177c47c61578e7202ccded0aecba74ae8e68076e133cfb090	common_voice_ca_20230007.mp3	"Els seus eslògans van anar variant depenent de l'any."	2	0	sixties	male	nord-occidental	ca	
1d487882a76e3930d7e4dbddcfe3051bff8e547c4c72f732598ccabed176e41ec52c2d46bcd0107177c47c61578e7202ccded0aecba74ae8e68076e133cfb090	common_voice_ca_20230009.mp3	Amb tot, el mas ha conservat sempre el nom de Peracaula.	2	0	sixties	male	nord-occidental	ca	
1d487882a76e3930d7e4dbddcfe3051bff8e547c4c72f732598ccabed176e41ec52c2d46bcd0107177c47c61578e7202ccded0aecba74ae8e68076e133cfb090	common_voice_ca_20230012.mp3	"Els déus oloren la fragància i s'ajunten afamats."	2	0	sixties	male	nord-occidental	ca	
1d487882a76e3930d7e4dbddcfe3051bff8e547c4c72f732598ccabed176e41ec52c2d46bcd0107177c47c61578e7202ccded0aecba74ae8e68076e133cfb090	common_voice_ca_20230015.mp3	Ha rebut també altres subvencions puntuals.	2	0	sixties	male	nord-occidental	ca	
1d487882a76e3930d7e4dbddcfe3051bff8e547c4c72f732598ccabed176e41ec52c2d46bcd0107177c47c61578e7202ccded0aecba74ae8e68076e133cfb090	common_voice_ca_20230075.mp3	Les seves fulles són palmades i amb lòbuls.	2	1	sixties	male	nord-occidental	ca	
1d487882a76e3930d7e4dbddcfe3051bff8e547c4c72f732598ccabed176e41ec52c2d46bcd0107177c47c61578e7202ccded0aecba74ae8e68076e133cfb090	common_voice_ca_20230078.mp3	"La seva façana està oberta a l'era a la part oriental de la casa."	2	1	sixties	male	nord-occidental	ca	
