client_id	path	sentence	up_votes	down_votes	age	gender	accents	locale	segment
512e80f8ee4a6f5111b97aa75499f7bf969eef66b7059cb19661ed14513de5c8cf9502139a45430efba68e2c8ce7b76fe5b6816e69b1e86b0c8e0071e233e378	common_voice_ca_19906401.mp3	Treballà com a cap del Servei de Recaptació de la Diputació de Girona.	2	0	thirties	male	central	ca	
512e80f8ee4a6f5111b97aa75499f7bf969eef66b7059cb19661ed14513de5c8cf9502139a45430efba68e2c8ce7b76fe5b6816e69b1e86b0c8e0071e233e378	common_voice_ca_19906402.mp3	En la seua prèdica, Cristòfol va realitzar nombrosos miracles.	2	0	thirties	male	central	ca	
512e80f8ee4a6f5111b97aa75499f7bf969eef66b7059cb19661ed14513de5c8cf9502139a45430efba68e2c8ce7b76fe5b6816e69b1e86b0c8e0071e233e378	common_voice_ca_19906403.mp3	Hi havia caça de llebres i perdius i pesca de truites.	2	1	thirties	male	central	ca	
512e80f8ee4a6f5111b97aa75499f7bf969eef66b7059cb19661ed14513de5c8cf9502139a45430efba68e2c8ce7b76fe5b6816e69b1e86b0c8e0071e233e378	common_voice_ca_19906404.mp3	Els traumes són diversos, accidents de trànsit, cremades greus, i atacs terroristes.	2	0	thirties	male	central	ca	
512e80f8ee4a6f5111b97aa75499f7bf969eef66b7059cb19661ed14513de5c8cf9502139a45430efba68e2c8ce7b76fe5b6816e69b1e86b0c8e0071e233e378	common_voice_ca_19906806.mp3	La part superior sol tenir una tapa que permet inspeccionar els aliments.	2	0	thirties	male	central	ca	
512e80f8ee4a6f5111b97aa75499f7bf969eef66b7059cb19661ed14513de5c8cf9502139a45430efba68e2c8ce7b76fe5b6816e69b1e86b0c8e0071e233e378	common_voice_ca_19906807.mp3	"Se situa en un entorn urbà, disposant d'accés per carrer."	2	0	thirties	male	central	ca	
512e80f8ee4a6f5111b97aa75499f7bf969eef66b7059cb19661ed14513de5c8cf9502139a45430efba68e2c8ce7b76fe5b6816e69b1e86b0c8e0071e233e378	common_voice_ca_19906808.mp3	"Totes les obertures són d'arc rebaixat amb impostes, i tenen motius decoratius treballats en pedra."	2	1	thirties	male	central	ca	
512e80f8ee4a6f5111b97aa75499f7bf969eef66b7059cb19661ed14513de5c8cf9502139a45430efba68e2c8ce7b76fe5b6816e69b1e86b0c8e0071e233e378	common_voice_ca_19906809.mp3	Els murs laterals presenten poques finestres.	2	0	thirties	male	central	ca	
512e80f8ee4a6f5111b97aa75499f7bf969eef66b7059cb19661ed14513de5c8cf9502139a45430efba68e2c8ce7b76fe5b6816e69b1e86b0c8e0071e233e378	common_voice_ca_19906810.mp3	"La masia és d'origen medieval."	2	0	thirties	male	central	ca	
512e80f8ee4a6f5111b97aa75499f7bf969eef66b7059cb19661ed14513de5c8cf9502139a45430efba68e2c8ce7b76fe5b6816e69b1e86b0c8e0071e233e378	common_voice_ca_19907654.mp3	"L'afectació de les vesícules seminals en un càncer de pròstata empitjora el pronòstic."	2	0	thirties	male	central	ca	
512e80f8ee4a6f5111b97aa75499f7bf969eef66b7059cb19661ed14513de5c8cf9502139a45430efba68e2c8ce7b76fe5b6816e69b1e86b0c8e0071e233e378	common_voice_ca_19907657.mp3	Se serveix una botifarra amb les mongetes al costat com acompanyament.	2	0	thirties	male	central	ca	
528214c92e8509dc7495f4952e82a55fe60218d215608f9042817c862ac67efbaed6c6262d2a6861b44bd477b5bbb841854f82b3e80b2c4fbcd3740e6d1364af	common_voice_ca_20345189.mp3	Va viure al monestir de Tlatelolco.	2	1				ca	
528214c92e8509dc7495f4952e82a55fe60218d215608f9042817c862ac67efbaed6c6262d2a6861b44bd477b5bbb841854f82b3e80b2c4fbcd3740e6d1364af	common_voice_ca_20345243.mp3	Li dóna com a ajuda un anell màgic.	2	1				ca	
528214c92e8509dc7495f4952e82a55fe60218d215608f9042817c862ac67efbaed6c6262d2a6861b44bd477b5bbb841854f82b3e80b2c4fbcd3740e6d1364af	common_voice_ca_20345280.mp3	I comença tot seguit a explicar-li la seva història.	2	1				ca	
528214c92e8509dc7495f4952e82a55fe60218d215608f9042817c862ac67efbaed6c6262d2a6861b44bd477b5bbb841854f82b3e80b2c4fbcd3740e6d1364af	common_voice_ca_20345281.mp3	Un gran nombre de festivals són esdeveniments anuals, o es repeteixen seguint alguna altra periodicitat.	2	1				ca	
528214c92e8509dc7495f4952e82a55fe60218d215608f9042817c862ac67efbaed6c6262d2a6861b44bd477b5bbb841854f82b3e80b2c4fbcd3740e6d1364af	common_voice_ca_20345282.mp3	El sufix -Ca indica que el calci és el catió dominant.	2	1				ca	
528214c92e8509dc7495f4952e82a55fe60218d215608f9042817c862ac67efbaed6c6262d2a6861b44bd477b5bbb841854f82b3e80b2c4fbcd3740e6d1364af	common_voice_ca_20345295.mp3	Els va transformar tots en ocells.	2	1				ca	
528214c92e8509dc7495f4952e82a55fe60218d215608f9042817c862ac67efbaed6c6262d2a6861b44bd477b5bbb841854f82b3e80b2c4fbcd3740e6d1364af	common_voice_ca_20345298.mp3	"Per al disseny d'un encàrrec tan singular calia el millor dels artistes:"	2	0				ca	
528214c92e8509dc7495f4952e82a55fe60218d215608f9042817c862ac67efbaed6c6262d2a6861b44bd477b5bbb841854f82b3e80b2c4fbcd3740e6d1364af	common_voice_ca_20345299.mp3	També ha escrit sis guions cinematogràfics.	2	0				ca	
528214c92e8509dc7495f4952e82a55fe60218d215608f9042817c862ac67efbaed6c6262d2a6861b44bd477b5bbb841854f82b3e80b2c4fbcd3740e6d1364af	common_voice_ca_20345314.mp3	"Han de dur una etiqueta que en garanteixi l'origen geogràfic."	2	0				ca	
528214c92e8509dc7495f4952e82a55fe60218d215608f9042817c862ac67efbaed6c6262d2a6861b44bd477b5bbb841854f82b3e80b2c4fbcd3740e6d1364af	common_voice_ca_20345316.mp3	Molts materials naturals i sintètics més grossos que una membrana també són semipermeables.	2	1				ca	
528214c92e8509dc7495f4952e82a55fe60218d215608f9042817c862ac67efbaed6c6262d2a6861b44bd477b5bbb841854f82b3e80b2c4fbcd3740e6d1364af	common_voice_ca_20345319.mp3	"Dóna valor a la incertesa en la forma de l'esperança de l'inversor."	2	0				ca	
528214c92e8509dc7495f4952e82a55fe60218d215608f9042817c862ac67efbaed6c6262d2a6861b44bd477b5bbb841854f82b3e80b2c4fbcd3740e6d1364af	common_voice_ca_20345321.mp3	Un altre membre bastant habitual és el poeta Enric Casasses, que hi toca el triangle.	2	1				ca	
528214c92e8509dc7495f4952e82a55fe60218d215608f9042817c862ac67efbaed6c6262d2a6861b44bd477b5bbb841854f82b3e80b2c4fbcd3740e6d1364af	common_voice_ca_20345322.mp3	"Es tracta d'un edifici entre mitgeres, de planta baixa, pis i golfes."	2	0				ca	
528214c92e8509dc7495f4952e82a55fe60218d215608f9042817c862ac67efbaed6c6262d2a6861b44bd477b5bbb841854f82b3e80b2c4fbcd3740e6d1364af	common_voice_ca_20345324.mp3	Blancaneu es va quedar amagada amb els set nans a la seva caseta del bosc.	2	1				ca	
528214c92e8509dc7495f4952e82a55fe60218d215608f9042817c862ac67efbaed6c6262d2a6861b44bd477b5bbb841854f82b3e80b2c4fbcd3740e6d1364af	common_voice_ca_20345327.mp3	Són posats essencialment als indrets on la frontera canvia de direcció.	2	1				ca	
528214c92e8509dc7495f4952e82a55fe60218d215608f9042817c862ac67efbaed6c6262d2a6861b44bd477b5bbb841854f82b3e80b2c4fbcd3740e6d1364af	common_voice_ca_20345364.mp3	La casa es troba en molt mal estat de conservació.	2	1				ca	
528214c92e8509dc7495f4952e82a55fe60218d215608f9042817c862ac67efbaed6c6262d2a6861b44bd477b5bbb841854f82b3e80b2c4fbcd3740e6d1364af	common_voice_ca_20345376.mp3	"Les seves cançons són les precursores del gòspel i van gaudir d'un gran èxit."	2	1				ca	
528214c92e8509dc7495f4952e82a55fe60218d215608f9042817c862ac67efbaed6c6262d2a6861b44bd477b5bbb841854f82b3e80b2c4fbcd3740e6d1364af	common_voice_ca_20345378.mp3	I no és molt tímid.	2	1				ca	
528214c92e8509dc7495f4952e82a55fe60218d215608f9042817c862ac67efbaed6c6262d2a6861b44bd477b5bbb841854f82b3e80b2c4fbcd3740e6d1364af	common_voice_ca_20345380.mp3	Malgrat la crida internacional, va ser sentenciat a vint anys de presó.	2	0				ca	
528214c92e8509dc7495f4952e82a55fe60218d215608f9042817c862ac67efbaed6c6262d2a6861b44bd477b5bbb841854f82b3e80b2c4fbcd3740e6d1364af	common_voice_ca_20345386.mp3	Està situat al marge dret del riu Muga.	2	1				ca	
528214c92e8509dc7495f4952e82a55fe60218d215608f9042817c862ac67efbaed6c6262d2a6861b44bd477b5bbb841854f82b3e80b2c4fbcd3740e6d1364af	common_voice_ca_20345397.mp3	El Jutge va dictar per a ella la Pena de mort.	2	1				ca	
5344fecf6211fb722dc0ac9933f57d0afc2bc4529b29f36e8d6fcc8e480ad77146a0c5400ca57c8dd7fc26e0a77649603294697f95132bd1beef370b95c415d5	common_voice_ca_24682034.mp3	El Comú volia un incentiu turístic més aprofitant l’ecosistema muntanyenc.	2	0	sixties	female		ca	
5344fecf6211fb722dc0ac9933f57d0afc2bc4529b29f36e8d6fcc8e480ad77146a0c5400ca57c8dd7fc26e0a77649603294697f95132bd1beef370b95c415d5	common_voice_ca_24682035.mp3	Els sorolls tonals sovint tenen harmònics.	2	0	sixties	female		ca	
5344fecf6211fb722dc0ac9933f57d0afc2bc4529b29f36e8d6fcc8e480ad77146a0c5400ca57c8dd7fc26e0a77649603294697f95132bd1beef370b95c415d5	common_voice_ca_24682038.mp3	"També existeixen encara incògnites sobre els orígens d'aquests satèl·lits."	2	0	sixties	female		ca	
5344fecf6211fb722dc0ac9933f57d0afc2bc4529b29f36e8d6fcc8e480ad77146a0c5400ca57c8dd7fc26e0a77649603294697f95132bd1beef370b95c415d5	common_voice_ca_24682069.mp3	El calendari julià li va restituir el trentè dia.	2	0	sixties	female		ca	
5344fecf6211fb722dc0ac9933f57d0afc2bc4529b29f36e8d6fcc8e480ad77146a0c5400ca57c8dd7fc26e0a77649603294697f95132bd1beef370b95c415d5	common_voice_ca_24682070.mp3	"Actualment les piscines són d'ús públic i estan en funcionament només a l'estiu."	2	0	sixties	female		ca	
5344fecf6211fb722dc0ac9933f57d0afc2bc4529b29f36e8d6fcc8e480ad77146a0c5400ca57c8dd7fc26e0a77649603294697f95132bd1beef370b95c415d5	common_voice_ca_24682071.mp3	Malgrat això, no volgueren abjurar de la fe i foren desterrats al desert de Fenícia.	2	0	sixties	female		ca	
5344fecf6211fb722dc0ac9933f57d0afc2bc4529b29f36e8d6fcc8e480ad77146a0c5400ca57c8dd7fc26e0a77649603294697f95132bd1beef370b95c415d5	common_voice_ca_24682072.mp3	"La teulada d'encavallades de fusta i llicorella acaba en un angle rom."	2	0	sixties	female		ca	
5344fecf6211fb722dc0ac9933f57d0afc2bc4529b29f36e8d6fcc8e480ad77146a0c5400ca57c8dd7fc26e0a77649603294697f95132bd1beef370b95c415d5	common_voice_ca_24682073.mp3	Conté un arxiu abundant, ben conservat i ordenat.	2	0	sixties	female		ca	
5344fecf6211fb722dc0ac9933f57d0afc2bc4529b29f36e8d6fcc8e480ad77146a0c5400ca57c8dd7fc26e0a77649603294697f95132bd1beef370b95c415d5	common_voice_ca_24682089.mp3	"Tradicionalment el sector primari ha mantingut una gran importància en l'economia sogorbina."	2	1	sixties	female		ca	
5344fecf6211fb722dc0ac9933f57d0afc2bc4529b29f36e8d6fcc8e480ad77146a0c5400ca57c8dd7fc26e0a77649603294697f95132bd1beef370b95c415d5	common_voice_ca_24682090.mp3	Aquestes declaracions van causar enrenou a Gal·les.	2	0	sixties	female		ca	
5344fecf6211fb722dc0ac9933f57d0afc2bc4529b29f36e8d6fcc8e480ad77146a0c5400ca57c8dd7fc26e0a77649603294697f95132bd1beef370b95c415d5	common_voice_ca_24682091.mp3	La Beta del Cavallet té quatre companyes òptiques, però no estan físicament relacionades.	2	0	sixties	female		ca	
5344fecf6211fb722dc0ac9933f57d0afc2bc4529b29f36e8d6fcc8e480ad77146a0c5400ca57c8dd7fc26e0a77649603294697f95132bd1beef370b95c415d5	common_voice_ca_24682092.mp3	"Per tant aquesta obra no desdiu de l'estil final del mestre."	2	0	sixties	female		ca	
5344fecf6211fb722dc0ac9933f57d0afc2bc4529b29f36e8d6fcc8e480ad77146a0c5400ca57c8dd7fc26e0a77649603294697f95132bd1beef370b95c415d5	common_voice_ca_24682134.mp3	"Mort assassinat, és venerat com a màrtir i sant per l'Església Ortodoxa Russa."	2	0	sixties	female		ca	
5344fecf6211fb722dc0ac9933f57d0afc2bc4529b29f36e8d6fcc8e480ad77146a0c5400ca57c8dd7fc26e0a77649603294697f95132bd1beef370b95c415d5	common_voice_ca_24682135.mp3	"Torna a l'Estartit, i després al Sant Gabriel, on seria capitana."	2	0	sixties	female		ca	
5344fecf6211fb722dc0ac9933f57d0afc2bc4529b29f36e8d6fcc8e480ad77146a0c5400ca57c8dd7fc26e0a77649603294697f95132bd1beef370b95c415d5	common_voice_ca_24682137.mp3	Es troba a Croàcia i a Bòsnia i Hercegovina.	2	0	sixties	female		ca	
5344fecf6211fb722dc0ac9933f57d0afc2bc4529b29f36e8d6fcc8e480ad77146a0c5400ca57c8dd7fc26e0a77649603294697f95132bd1beef370b95c415d5	common_voice_ca_24682138.mp3	"L'eix de l'obra són les aventures amoroses del protagonista, de caràcter autobiogràfic."	2	0	sixties	female		ca	
5344fecf6211fb722dc0ac9933f57d0afc2bc4529b29f36e8d6fcc8e480ad77146a0c5400ca57c8dd7fc26e0a77649603294697f95132bd1beef370b95c415d5	common_voice_ca_24682174.mp3	Els seus últims anys els va passar a Egipte.	2	0	sixties	female		ca	
5344fecf6211fb722dc0ac9933f57d0afc2bc4529b29f36e8d6fcc8e480ad77146a0c5400ca57c8dd7fc26e0a77649603294697f95132bd1beef370b95c415d5	common_voice_ca_24682175.mp3	Els dos terrenys tenen restos de jaciments prehistòrics.	2	0	sixties	female		ca	
5344fecf6211fb722dc0ac9933f57d0afc2bc4529b29f36e8d6fcc8e480ad77146a0c5400ca57c8dd7fc26e0a77649603294697f95132bd1beef370b95c415d5	common_voice_ca_24682176.mp3	Aproximadament la meitat de la població municipal viu a la capital.	2	0	sixties	female		ca	
5344fecf6211fb722dc0ac9933f57d0afc2bc4529b29f36e8d6fcc8e480ad77146a0c5400ca57c8dd7fc26e0a77649603294697f95132bd1beef370b95c415d5	common_voice_ca_24682177.mp3	La Segona Guerra Mundial posà fi a la seva carrera com a ciclista.	2	1	sixties	female		ca	
5344fecf6211fb722dc0ac9933f57d0afc2bc4529b29f36e8d6fcc8e480ad77146a0c5400ca57c8dd7fc26e0a77649603294697f95132bd1beef370b95c415d5	common_voice_ca_24682178.mp3	Es troba a Xile i les Illes Òrcades del Sud.	2	0	sixties	female		ca	
5b34271641ddaa39b71893bf90ba39f21d3e7ebbedb7e65f6c5df05aab48a7efbf52e88d67e6eecc1cd6f831cd198c749d0813d8b58260b709a060aecc8d99de	common_voice_ca_18969185.mp3	Per qui té gana, val més un bon menjar que un bon cantar.	2	0				ca	
5b34271641ddaa39b71893bf90ba39f21d3e7ebbedb7e65f6c5df05aab48a7efbf52e88d67e6eecc1cd6f831cd198c749d0813d8b58260b709a060aecc8d99de	common_voice_ca_18969186.mp3	En especial, cal adoptar les mesures protectores necessàries per a garantir la mínima afecció a les aus.	2	1				ca	
5b34271641ddaa39b71893bf90ba39f21d3e7ebbedb7e65f6c5df05aab48a7efbf52e88d67e6eecc1cd6f831cd198c749d0813d8b58260b709a060aecc8d99de	common_voice_ca_18969187.mp3	La prova era que va restar despert a pesar que el cos es negava a obeir-lo.	2	1				ca	
5b34271641ddaa39b71893bf90ba39f21d3e7ebbedb7e65f6c5df05aab48a7efbf52e88d67e6eecc1cd6f831cd198c749d0813d8b58260b709a060aecc8d99de	common_voice_ca_18969188.mp3	"Consta informe favorable de l'Oficina del Pla de Carreteres de setze de novembre de dos mil."	2	0				ca	
5b34271641ddaa39b71893bf90ba39f21d3e7ebbedb7e65f6c5df05aab48a7efbf52e88d67e6eecc1cd6f831cd198c749d0813d8b58260b709a060aecc8d99de	common_voice_ca_18969677.mp3	"Quimet és un xicon d'allò més normal en els temps que corren."	2	0				ca	
5b34271641ddaa39b71893bf90ba39f21d3e7ebbedb7e65f6c5df05aab48a7efbf52e88d67e6eecc1cd6f831cd198c749d0813d8b58260b709a060aecc8d99de	common_voice_ca_18969681.mp3	Venim de Sant Jaume de Llierca.	2	0				ca	
5b34271641ddaa39b71893bf90ba39f21d3e7ebbedb7e65f6c5df05aab48a7efbf52e88d67e6eecc1cd6f831cd198c749d0813d8b58260b709a060aecc8d99de	common_voice_ca_18969702.mp3	Entesos.	2	1				ca	
5b34271641ddaa39b71893bf90ba39f21d3e7ebbedb7e65f6c5df05aab48a7efbf52e88d67e6eecc1cd6f831cd198c749d0813d8b58260b709a060aecc8d99de	common_voice_ca_18969705.mp3	Vaig adonar-me amb sorpresa que no ostenten cap càrrec públic.	2	0				ca	
5b34271641ddaa39b71893bf90ba39f21d3e7ebbedb7e65f6c5df05aab48a7efbf52e88d67e6eecc1cd6f831cd198c749d0813d8b58260b709a060aecc8d99de	common_voice_ca_18969741.mp3	"Peix de cames, guarda't d'ell."	2	0				ca	
5b34271641ddaa39b71893bf90ba39f21d3e7ebbedb7e65f6c5df05aab48a7efbf52e88d67e6eecc1cd6f831cd198c749d0813d8b58260b709a060aecc8d99de	common_voice_ca_18969742.mp3	No correm cap risc perquè és un paratge clar i es poden veure venir els perills amb antelació.	2	0				ca	
5b34271641ddaa39b71893bf90ba39f21d3e7ebbedb7e65f6c5df05aab48a7efbf52e88d67e6eecc1cd6f831cd198c749d0813d8b58260b709a060aecc8d99de	common_voice_ca_18969784.mp3	I mentre la conversa seguia el seu curs, sonava a cada instant la campaneta de la porta.	2	0				ca	
5b34271641ddaa39b71893bf90ba39f21d3e7ebbedb7e65f6c5df05aab48a7efbf52e88d67e6eecc1cd6f831cd198c749d0813d8b58260b709a060aecc8d99de	common_voice_ca_18969878.mp3	Ambdós llits discorren en aquesta zona entre terrenys agrícola i que no presenta valors ambientals significatius.	2	1				ca	
5b34271641ddaa39b71893bf90ba39f21d3e7ebbedb7e65f6c5df05aab48a7efbf52e88d67e6eecc1cd6f831cd198c749d0813d8b58260b709a060aecc8d99de	common_voice_ca_18969880.mp3	Els alls per Nadal, ni sembrats ni per sembrar.	2	0				ca	
5b34271641ddaa39b71893bf90ba39f21d3e7ebbedb7e65f6c5df05aab48a7efbf52e88d67e6eecc1cd6f831cd198c749d0813d8b58260b709a060aecc8d99de	common_voice_ca_18969987.mp3	Per tant la implicació tracta de proposar, fer, visibilitzar, catalitzar i negociar.	2	1				ca	
5b34271641ddaa39b71893bf90ba39f21d3e7ebbedb7e65f6c5df05aab48a7efbf52e88d67e6eecc1cd6f831cd198c749d0813d8b58260b709a060aecc8d99de	common_voice_ca_18969991.mp3	"Aquest factor corrector serà d'un mínim d'un i un màxim de dos, en funció de la menor o major liquidació."	2	1				ca	
5ebd4554d07b80d7dfd303e18e2736033be5ff48c57677d392803db0ac6ad7b91d1eb4c0a1632e84dd035181f5a97d1d54e46f94235b19904029675845d30003	common_voice_ca_17454486.mp3	"La puntuació atribuïda com a resultat de l'entrevista no podrà superar els set punts."	2	1	thirties	male	central	ca	
5ebd4554d07b80d7dfd303e18e2736033be5ff48c57677d392803db0ac6ad7b91d1eb4c0a1632e84dd035181f5a97d1d54e46f94235b19904029675845d30003	common_voice_ca_17454487.mp3	"Només s'estima i es tem allò que ha d'existir llargament."	2	0	thirties	male	central	ca	
5ebd4554d07b80d7dfd303e18e2736033be5ff48c57677d392803db0ac6ad7b91d1eb4c0a1632e84dd035181f5a97d1d54e46f94235b19904029675845d30003	common_voice_ca_17454489.mp3	Saps una cosa?	2	0	thirties	male	central	ca	
5ebd4554d07b80d7dfd303e18e2736033be5ff48c57677d392803db0ac6ad7b91d1eb4c0a1632e84dd035181f5a97d1d54e46f94235b19904029675845d30003	common_voice_ca_17454490.mp3	Els diners no coneixen amo.	2	0	thirties	male	central	ca	
5ebd4554d07b80d7dfd303e18e2736033be5ff48c57677d392803db0ac6ad7b91d1eb4c0a1632e84dd035181f5a97d1d54e46f94235b19904029675845d30003	common_voice_ca_17454511.mp3	No vulguis tant argent gastar, per a ta filla maridar.	2	1	thirties	male	central	ca	
5ebd4554d07b80d7dfd303e18e2736033be5ff48c57677d392803db0ac6ad7b91d1eb4c0a1632e84dd035181f5a97d1d54e46f94235b19904029675845d30003	common_voice_ca_17454514.mp3	El tema de la solemnitat és un tema de tipus harmònic.	2	0	thirties	male	central	ca	
5ebd4554d07b80d7dfd303e18e2736033be5ff48c57677d392803db0ac6ad7b91d1eb4c0a1632e84dd035181f5a97d1d54e46f94235b19904029675845d30003	common_voice_ca_17454515.mp3	"Valia més això que pescar en mals llocs o treballar en terres d'altri."	2	0	thirties	male	central	ca	
5ebd4554d07b80d7dfd303e18e2736033be5ff48c57677d392803db0ac6ad7b91d1eb4c0a1632e84dd035181f5a97d1d54e46f94235b19904029675845d30003	common_voice_ca_17454521.mp3	"La puntuació màxima serà d'un punt."	2	0	thirties	male	central	ca	
5ebd4554d07b80d7dfd303e18e2736033be5ff48c57677d392803db0ac6ad7b91d1eb4c0a1632e84dd035181f5a97d1d54e46f94235b19904029675845d30003	common_voice_ca_17454522.mp3	El dimoni té una manta i un tabal.	2	0	thirties	male	central	ca	
5ebd4554d07b80d7dfd303e18e2736033be5ff48c57677d392803db0ac6ad7b91d1eb4c0a1632e84dd035181f5a97d1d54e46f94235b19904029675845d30003	common_voice_ca_17454523.mp3	"Podeu baixar l'última versió del programa amb l'arxiu de la traducció en català des d'aquesta pàgina del Rebost."	2	0	thirties	male	central	ca	
5ebd4554d07b80d7dfd303e18e2736033be5ff48c57677d392803db0ac6ad7b91d1eb4c0a1632e84dd035181f5a97d1d54e46f94235b19904029675845d30003	common_voice_ca_17454531.mp3	"Cada any s'hi sumen més llengües i es duplica el nombre d'articles."	2	0	thirties	male	central	ca	
5ebd4554d07b80d7dfd303e18e2736033be5ff48c57677d392803db0ac6ad7b91d1eb4c0a1632e84dd035181f5a97d1d54e46f94235b19904029675845d30003	common_voice_ca_17454532.mp3	"El tipus impositiu és de dos coma cinc euros per quilogram d'òxids de nitrogen."	2	1	thirties	male	central	ca	
5ebd4554d07b80d7dfd303e18e2736033be5ff48c57677d392803db0ac6ad7b91d1eb4c0a1632e84dd035181f5a97d1d54e46f94235b19904029675845d30003	common_voice_ca_17454533.mp3	Qualsevol altre legalment possible i que no constitueixi recurs ordinari.	2	0	thirties	male	central	ca	
5ebd4554d07b80d7dfd303e18e2736033be5ff48c57677d392803db0ac6ad7b91d1eb4c0a1632e84dd035181f5a97d1d54e46f94235b19904029675845d30003	common_voice_ca_17454534.mp3	Si anem parant i fent fotos, hi arribarem cap a les quatre de la tarda.	2	0	thirties	male	central	ca	
5ebd4554d07b80d7dfd303e18e2736033be5ff48c57677d392803db0ac6ad7b91d1eb4c0a1632e84dd035181f5a97d1d54e46f94235b19904029675845d30003	common_voice_ca_17454535.mp3	"A Bonrepòs, qui no pot menjar carn es menja l'os."	2	0	thirties	male	central	ca	
5ebd4554d07b80d7dfd303e18e2736033be5ff48c57677d392803db0ac6ad7b91d1eb4c0a1632e84dd035181f5a97d1d54e46f94235b19904029675845d30003	common_voice_ca_17454571.mp3	Ho fa sobre el traçat ja existent, excepte en el tram més accidentat.	2	0	thirties	male	central	ca	
5ebd4554d07b80d7dfd303e18e2736033be5ff48c57677d392803db0ac6ad7b91d1eb4c0a1632e84dd035181f5a97d1d54e46f94235b19904029675845d30003	common_voice_ca_17454572.mp3	Potser açò sembla massa poca cosa per als agosarats i massa atrevit per als cauts.	2	0	thirties	male	central	ca	
5ebd4554d07b80d7dfd303e18e2736033be5ff48c57677d392803db0ac6ad7b91d1eb4c0a1632e84dd035181f5a97d1d54e46f94235b19904029675845d30003	common_voice_ca_17454573.mp3	"Internet fou una finestra d'oportunitat per a les llengües minoritzades."	2	1	thirties	male	central	ca	
76664555db3e43abd9531c50fc18c5384b8af10a8a38a4ababe0dca235381f9855aff690dbcc63b8be0647abcbea28dd97aa66c1e78d5b84ce2a975c08d810d2	common_voice_ca_19037212.mp3	"Sembla com si ens volgués presentar el protagonista carregat d'un pes més i més gran a mesura que el relat avança."	2	0	fifties	male	central	ca	
76664555db3e43abd9531c50fc18c5384b8af10a8a38a4ababe0dca235381f9855aff690dbcc63b8be0647abcbea28dd97aa66c1e78d5b84ce2a975c08d810d2	common_voice_ca_19037213.mp3	"Que siguin projectes d'innovació, expansió i millora de la competitivitat."	2	0	fifties	male	central	ca	
76664555db3e43abd9531c50fc18c5384b8af10a8a38a4ababe0dca235381f9855aff690dbcc63b8be0647abcbea28dd97aa66c1e78d5b84ce2a975c08d810d2	common_voice_ca_19037290.mp3	Un núvol de xicons quasi nus seguia el barquer amb certa admiració.	2	0	fifties	male	central	ca	
76664555db3e43abd9531c50fc18c5384b8af10a8a38a4ababe0dca235381f9855aff690dbcc63b8be0647abcbea28dd97aa66c1e78d5b84ce2a975c08d810d2	common_voice_ca_19037291.mp3	"Quant a programació, l'XML s'està imposant gràcies a la seva flexibilitat."	2	0	fifties	male	central	ca	
76664555db3e43abd9531c50fc18c5384b8af10a8a38a4ababe0dca235381f9855aff690dbcc63b8be0647abcbea28dd97aa66c1e78d5b84ce2a975c08d810d2	common_voice_ca_19037292.mp3	Qui ve de mala raça, sempre fa poc i es pensa que fa massa.	2	0	fifties	male	central	ca	
76664555db3e43abd9531c50fc18c5384b8af10a8a38a4ababe0dca235381f9855aff690dbcc63b8be0647abcbea28dd97aa66c1e78d5b84ce2a975c08d810d2	common_voice_ca_19037293.mp3	"Al matí, tot vi; a la tarda, res d'aigua, i al vespre, vi sempre."	2	0	fifties	male	central	ca	
76664555db3e43abd9531c50fc18c5384b8af10a8a38a4ababe0dca235381f9855aff690dbcc63b8be0647abcbea28dd97aa66c1e78d5b84ce2a975c08d810d2	common_voice_ca_19037294.mp3	Qui no en té, no en pot donar.	2	0	fifties	male	central	ca	
76664555db3e43abd9531c50fc18c5384b8af10a8a38a4ababe0dca235381f9855aff690dbcc63b8be0647abcbea28dd97aa66c1e78d5b84ce2a975c08d810d2	common_voice_ca_19037300.mp3	La pluja abans de Nadal, per mitja pedregada val.	2	0	fifties	male	central	ca	
76664555db3e43abd9531c50fc18c5384b8af10a8a38a4ababe0dca235381f9855aff690dbcc63b8be0647abcbea28dd97aa66c1e78d5b84ce2a975c08d810d2	common_voice_ca_19037302.mp3	En el supòsit que sols es presentara una candidatura vàlida, podrà proclamar-se automàticament electa.	2	0	fifties	male	central	ca	
76664555db3e43abd9531c50fc18c5384b8af10a8a38a4ababe0dca235381f9855aff690dbcc63b8be0647abcbea28dd97aa66c1e78d5b84ce2a975c08d810d2	common_voice_ca_19037304.mp3	"La caça i la guerra li semblen les úniques tasques dignes d'un home."	2	0	fifties	male	central	ca	
76664555db3e43abd9531c50fc18c5384b8af10a8a38a4ababe0dca235381f9855aff690dbcc63b8be0647abcbea28dd97aa66c1e78d5b84ce2a975c08d810d2	common_voice_ca_19037311.mp3	Segurament, les llicències actualment més indicades són les Creative Commons.	2	1	fifties	male	central	ca	
76664555db3e43abd9531c50fc18c5384b8af10a8a38a4ababe0dca235381f9855aff690dbcc63b8be0647abcbea28dd97aa66c1e78d5b84ce2a975c08d810d2	common_voice_ca_19037315.mp3	Pots signar per setze mil.	2	0	fifties	male	central	ca	
76664555db3e43abd9531c50fc18c5384b8af10a8a38a4ababe0dca235381f9855aff690dbcc63b8be0647abcbea28dd97aa66c1e78d5b84ce2a975c08d810d2	common_voice_ca_19037316.mp3	La casa per la teulada.	2	0	fifties	male	central	ca	
76664555db3e43abd9531c50fc18c5384b8af10a8a38a4ababe0dca235381f9855aff690dbcc63b8be0647abcbea28dd97aa66c1e78d5b84ce2a975c08d810d2	common_voice_ca_19037317.mp3	"Noves opcions d'integració de correu electrònic per usuaris que vulguin enviar correus amb adjuncions."	3	0	fifties	male	central	ca	
76664555db3e43abd9531c50fc18c5384b8af10a8a38a4ababe0dca235381f9855aff690dbcc63b8be0647abcbea28dd97aa66c1e78d5b84ce2a975c08d810d2	common_voice_ca_19037318.mp3	Tant diràs, que em faràs riure.	2	0	fifties	male	central	ca	
76664555db3e43abd9531c50fc18c5384b8af10a8a38a4ababe0dca235381f9855aff690dbcc63b8be0647abcbea28dd97aa66c1e78d5b84ce2a975c08d810d2	common_voice_ca_19037319.mp3	Venim de Puigdàlber.	2	0	fifties	male	central	ca	
7877eac8d30d94dc490a2e7c9159565efab85271a1351344052c9886002e90c43c40629db621f591a7b962620e524d8fedcdcac3ec511e33520682d1fe248831	common_voice_ca_19895193.mp3	En els textos clàssics també es coneix alternativament com a peà.	2	0				ca	
7877eac8d30d94dc490a2e7c9159565efab85271a1351344052c9886002e90c43c40629db621f591a7b962620e524d8fedcdcac3ec511e33520682d1fe248831	common_voice_ca_19895195.mp3	"Els cometes poden passar per una fase de transició a mesura que s'acosten a l'extinció."	2	0				ca	
7877eac8d30d94dc490a2e7c9159565efab85271a1351344052c9886002e90c43c40629db621f591a7b962620e524d8fedcdcac3ec511e33520682d1fe248831	common_voice_ca_19895196.mp3	Les seves activitats van tenir una significativa cobertura periodística.	2	0				ca	
