client_id	path	sentence	up_votes	down_votes	age	gender	accents	locale	segment
a24d8fd887fa8e7b7d1c8581ddea17bc4ffe675ab888f836ffc75951d1ce3e1b0b79b2c8d9256f6d35663a18e1df1727cbe943c7230bf9347b0ed274b39b33ac	common_voice_ca_21779547.mp3	"Produeixen cabdells petits i es destinen al consum immediat, ja que no resisteixen l'emmagatzematge."	2	1	thirties	female	valencià	ca	
a24d8fd887fa8e7b7d1c8581ddea17bc4ffe675ab888f836ffc75951d1ce3e1b0b79b2c8d9256f6d35663a18e1df1727cbe943c7230bf9347b0ed274b39b33ac	common_voice_ca_21779548.mp3	"Estudià especialment la flora de l'orient d'Àsia, Filipines i el Pacífic."	2	0	thirties	female	valencià	ca	
a24d8fd887fa8e7b7d1c8581ddea17bc4ffe675ab888f836ffc75951d1ce3e1b0b79b2c8d9256f6d35663a18e1df1727cbe943c7230bf9347b0ed274b39b33ac	common_voice_ca_21779549.mp3	"L'escorça havia estat usada com a purgant."	2	0	thirties	female	valencià	ca	
a24d8fd887fa8e7b7d1c8581ddea17bc4ffe675ab888f836ffc75951d1ce3e1b0b79b2c8d9256f6d35663a18e1df1727cbe943c7230bf9347b0ed274b39b33ac	common_voice_ca_21779550.mp3	El territori és de secà, amb camps i prats, on es conreen alguns arbres fruiters.	2	0	thirties	female	valencià	ca	
a24d8fd887fa8e7b7d1c8581ddea17bc4ffe675ab888f836ffc75951d1ce3e1b0b79b2c8d9256f6d35663a18e1df1727cbe943c7230bf9347b0ed274b39b33ac	common_voice_ca_21779661.mp3	"Figueroles de Domenyo limita amb els termes municipals d'Andilla, Calles, Xelva, Domenyo i el Villar."	2	0	thirties	female	valencià	ca	
a24d8fd887fa8e7b7d1c8581ddea17bc4ffe675ab888f836ffc75951d1ce3e1b0b79b2c8d9256f6d35663a18e1df1727cbe943c7230bf9347b0ed274b39b33ac	common_voice_ca_21779663.mp3	"Està desenvolupada en baixos, dos pisos i dues galeries laterals que formen l'acabament de l'edifici."	2	1	thirties	female	valencià	ca	
a24d8fd887fa8e7b7d1c8581ddea17bc4ffe675ab888f836ffc75951d1ce3e1b0b79b2c8d9256f6d35663a18e1df1727cbe943c7230bf9347b0ed274b39b33ac	common_voice_ca_21779664.mp3	Va escriure diversos llibres i nombrosos articles.	2	0	thirties	female	valencià	ca	
a24d8fd887fa8e7b7d1c8581ddea17bc4ffe675ab888f836ffc75951d1ce3e1b0b79b2c8d9256f6d35663a18e1df1727cbe943c7230bf9347b0ed274b39b33ac	common_voice_ca_21779665.mp3	Més tard en aquest mateix any, va guanyar el títol sud-americà en mitja marató.	2	0	thirties	female	valencià	ca	
a24d8fd887fa8e7b7d1c8581ddea17bc4ffe675ab888f836ffc75951d1ce3e1b0b79b2c8d9256f6d35663a18e1df1727cbe943c7230bf9347b0ed274b39b33ac	common_voice_ca_21779761.mp3	Les seves instal·lacions van passar a ser una base militar nord-americana.	2	0	thirties	female	valencià	ca	
a24d8fd887fa8e7b7d1c8581ddea17bc4ffe675ab888f836ffc75951d1ce3e1b0b79b2c8d9256f6d35663a18e1df1727cbe943c7230bf9347b0ed274b39b33ac	common_voice_ca_21779762.mp3	Aquests recomanen que es portin tropes de la Legió i de Regulars des del Marroc.	2	0	thirties	female	valencià	ca	
a24d8fd887fa8e7b7d1c8581ddea17bc4ffe675ab888f836ffc75951d1ce3e1b0b79b2c8d9256f6d35663a18e1df1727cbe943c7230bf9347b0ed274b39b33ac	common_voice_ca_21779769.mp3	És centrecampista i també integrant de la selecció nacional femenina turca.	2	0	thirties	female	valencià	ca	
a24d8fd887fa8e7b7d1c8581ddea17bc4ffe675ab888f836ffc75951d1ce3e1b0b79b2c8d9256f6d35663a18e1df1727cbe943c7230bf9347b0ed274b39b33ac	common_voice_ca_21779812.mp3	Durant la República, des de l’agrupació socialista, participà activament en la política local.	2	0	thirties	female	valencià	ca	
a24d8fd887fa8e7b7d1c8581ddea17bc4ffe675ab888f836ffc75951d1ce3e1b0b79b2c8d9256f6d35663a18e1df1727cbe943c7230bf9347b0ed274b39b33ac	common_voice_ca_21779814.mp3	"Es tracta d'un partit sense identificació clara en l'eix esquerra-dreta."	2	0	thirties	female	valencià	ca	
a24d8fd887fa8e7b7d1c8581ddea17bc4ffe675ab888f836ffc75951d1ce3e1b0b79b2c8d9256f6d35663a18e1df1727cbe943c7230bf9347b0ed274b39b33ac	common_voice_ca_21779817.mp3	Avui treballa en un estudi sobre el lèxic de les ciències de la salut.	2	0	thirties	female	valencià	ca	
a24d8fd887fa8e7b7d1c8581ddea17bc4ffe675ab888f836ffc75951d1ce3e1b0b79b2c8d9256f6d35663a18e1df1727cbe943c7230bf9347b0ed274b39b33ac	common_voice_ca_21779871.mp3	"Posteriorment ha treballat com a enginyer tècnic a l'ajuntament de Sant Antoni de Portmany."	2	1	thirties	female	valencià	ca	
a24d8fd887fa8e7b7d1c8581ddea17bc4ffe675ab888f836ffc75951d1ce3e1b0b79b2c8d9256f6d35663a18e1df1727cbe943c7230bf9347b0ed274b39b33ac	common_voice_ca_21779872.mp3	Compta amb una universitat.	2	0	thirties	female	valencià	ca	
a24d8fd887fa8e7b7d1c8581ddea17bc4ffe675ab888f836ffc75951d1ce3e1b0b79b2c8d9256f6d35663a18e1df1727cbe943c7230bf9347b0ed274b39b33ac	common_voice_ca_21779873.mp3	És de tres crugies perpendiculars a façana, de planta baixa i pis.	2	1	thirties	female	valencià	ca	
a53e85e2fb9c01b90bef8b679a325f43a6f16190a5aca8366cbabbce091a51f5da50519cb2246904f9abd5f4a1d20faae2498b72396cb346c087a29d972063cd	common_voice_ca_20167020.mp3	Com a cim de la creu, una creu de pedra.	2	0	thirties	male	nord-occidental	ca	
a53e85e2fb9c01b90bef8b679a325f43a6f16190a5aca8366cbabbce091a51f5da50519cb2246904f9abd5f4a1d20faae2498b72396cb346c087a29d972063cd	common_voice_ca_20167021.mp3	A la mort de Joan, Segimon va obtenir també el tron suec.	2	0	thirties	male	nord-occidental	ca	
a53e85e2fb9c01b90bef8b679a325f43a6f16190a5aca8366cbabbce091a51f5da50519cb2246904f9abd5f4a1d20faae2498b72396cb346c087a29d972063cd	common_voice_ca_20167022.mp3	"No se n'han descrit subespècies."	2	0	thirties	male	nord-occidental	ca	
a53e85e2fb9c01b90bef8b679a325f43a6f16190a5aca8366cbabbce091a51f5da50519cb2246904f9abd5f4a1d20faae2498b72396cb346c087a29d972063cd	common_voice_ca_20167023.mp3	"Actualment, l'aigua subministrada prové del sistema d'abastament d'aigua de Cornudella."	2	0	thirties	male	nord-occidental	ca	
a53e85e2fb9c01b90bef8b679a325f43a6f16190a5aca8366cbabbce091a51f5da50519cb2246904f9abd5f4a1d20faae2498b72396cb346c087a29d972063cd	common_voice_ca_20167024.mp3	La pau és necessària per reconstruir les ciutats i pobles destruïts.	2	0	thirties	male	nord-occidental	ca	
a53e85e2fb9c01b90bef8b679a325f43a6f16190a5aca8366cbabbce091a51f5da50519cb2246904f9abd5f4a1d20faae2498b72396cb346c087a29d972063cd	common_voice_ca_20167045.mp3	Indica la inclinació del front.	2	0	thirties	male	nord-occidental	ca	
a53e85e2fb9c01b90bef8b679a325f43a6f16190a5aca8366cbabbce091a51f5da50519cb2246904f9abd5f4a1d20faae2498b72396cb346c087a29d972063cd	common_voice_ca_20167046.mp3	Les ruïnes de Gortina han estat descrites per nombrosos autors.	2	0	thirties	male	nord-occidental	ca	
a53e85e2fb9c01b90bef8b679a325f43a6f16190a5aca8366cbabbce091a51f5da50519cb2246904f9abd5f4a1d20faae2498b72396cb346c087a29d972063cd	common_voice_ca_20167048.mp3	"Part dels seus materials provenen de l'antic castell."	2	0	thirties	male	nord-occidental	ca	
a53e85e2fb9c01b90bef8b679a325f43a6f16190a5aca8366cbabbce091a51f5da50519cb2246904f9abd5f4a1d20faae2498b72396cb346c087a29d972063cd	common_voice_ca_20167110.mp3	Curt pròleg inicial, amb un primer sector ondulat i la segona part totalment plana.	2	0	thirties	male	nord-occidental	ca	
a53e85e2fb9c01b90bef8b679a325f43a6f16190a5aca8366cbabbce091a51f5da50519cb2246904f9abd5f4a1d20faae2498b72396cb346c087a29d972063cd	common_voice_ca_20167111.mp3	"És comanador d'alguns convents i predica i promou el moviment espiritual de l'Escola de Crist."	2	0	thirties	male	nord-occidental	ca	
a53e85e2fb9c01b90bef8b679a325f43a6f16190a5aca8366cbabbce091a51f5da50519cb2246904f9abd5f4a1d20faae2498b72396cb346c087a29d972063cd	common_voice_ca_20167112.mp3	Es troba a Laos, nord del Vietnam i sud de la Xina.	2	0	thirties	male	nord-occidental	ca	
a53e85e2fb9c01b90bef8b679a325f43a6f16190a5aca8366cbabbce091a51f5da50519cb2246904f9abd5f4a1d20faae2498b72396cb346c087a29d972063cd	common_voice_ca_20167113.mp3	"És un mineral important que s'extreu com a mena del bor."	2	0	thirties	male	nord-occidental	ca	
a53e85e2fb9c01b90bef8b679a325f43a6f16190a5aca8366cbabbce091a51f5da50519cb2246904f9abd5f4a1d20faae2498b72396cb346c087a29d972063cd	common_voice_ca_20167114.mp3	A la façana principal, encarada al mar, hi ha franges ornamentals verticals i horitzontals.	2	0	thirties	male	nord-occidental	ca	
a53e85e2fb9c01b90bef8b679a325f43a6f16190a5aca8366cbabbce091a51f5da50519cb2246904f9abd5f4a1d20faae2498b72396cb346c087a29d972063cd	common_voice_ca_20167125.mp3	"Actualment és membre de la Comissió Legislativa d'Economia i de la Comissió Permanent."	2	1	thirties	male	nord-occidental	ca	
a53e85e2fb9c01b90bef8b679a325f43a6f16190a5aca8366cbabbce091a51f5da50519cb2246904f9abd5f4a1d20faae2498b72396cb346c087a29d972063cd	common_voice_ca_20167127.mp3	Va pertànyer a la francmaçoneria, fou membre del Gran Orient de França.	2	0	thirties	male	nord-occidental	ca	
a53e85e2fb9c01b90bef8b679a325f43a6f16190a5aca8366cbabbce091a51f5da50519cb2246904f9abd5f4a1d20faae2498b72396cb346c087a29d972063cd	common_voice_ca_20167129.mp3	"D'aquesta manera s'aconsegueix que l'angle del perigeu sigui constant durant molt de temps."	2	0	thirties	male	nord-occidental	ca	
a53e85e2fb9c01b90bef8b679a325f43a6f16190a5aca8366cbabbce091a51f5da50519cb2246904f9abd5f4a1d20faae2498b72396cb346c087a29d972063cd	common_voice_ca_20167130.mp3	Els seus subtítols del setmanari van ser dos.	2	0	thirties	male	nord-occidental	ca	
a53e85e2fb9c01b90bef8b679a325f43a6f16190a5aca8366cbabbce091a51f5da50519cb2246904f9abd5f4a1d20faae2498b72396cb346c087a29d972063cd	common_voice_ca_20167203.mp3	També ha estat col·laborador al diari El País.	2	0	thirties	male	nord-occidental	ca	
a53e85e2fb9c01b90bef8b679a325f43a6f16190a5aca8366cbabbce091a51f5da50519cb2246904f9abd5f4a1d20faae2498b72396cb346c087a29d972063cd	common_voice_ca_20167205.mp3	"Les seves reclamacions territorials són les illes de la desembocadura del riu Uruguai amb l'Argentina."	2	0	thirties	male	nord-occidental	ca	
a53e85e2fb9c01b90bef8b679a325f43a6f16190a5aca8366cbabbce091a51f5da50519cb2246904f9abd5f4a1d20faae2498b72396cb346c087a29d972063cd	common_voice_ca_20167208.mp3	"Les altres restes del rei van desaparèixer en ser destruïda la catedral d'Oradea pels turcs."	2	0	thirties	male	nord-occidental	ca	
a53e85e2fb9c01b90bef8b679a325f43a6f16190a5aca8366cbabbce091a51f5da50519cb2246904f9abd5f4a1d20faae2498b72396cb346c087a29d972063cd	common_voice_ca_20167209.mp3	El seu pare, nascut a Mèxic, va venir a Espanya gràcies a una herència.	2	0	thirties	male	nord-occidental	ca	
a87e68210abf69b864018e6ab121b82eeb904fd5d1c0d1b2c5574bf6544a3ff2fca20f35e358b32efe1a1126acdffb62c59d3239deca8249b3b0eca322141f87	common_voice_ca_17375097.mp3	"És precisament a causa d'aquesta declaració que fra Bernat reconeix l'àngel com a tal."	2	0				ca	
a87e68210abf69b864018e6ab121b82eeb904fd5d1c0d1b2c5574bf6544a3ff2fca20f35e358b32efe1a1126acdffb62c59d3239deca8249b3b0eca322141f87	common_voice_ca_17375099.mp3	"Lleva't amb el sol i vés a dormir sense gresol."	2	0				ca	
a87e68210abf69b864018e6ab121b82eeb904fd5d1c0d1b2c5574bf6544a3ff2fca20f35e358b32efe1a1126acdffb62c59d3239deca8249b3b0eca322141f87	common_voice_ca_17375101.mp3	Llavors voldria —va afegir mentre la besava— ser al teu costat fins a la fi de la meua vida!	3	0				ca	
a87e68210abf69b864018e6ab121b82eeb904fd5d1c0d1b2c5574bf6544a3ff2fca20f35e358b32efe1a1126acdffb62c59d3239deca8249b3b0eca322141f87	common_voice_ca_17375107.mp3	Què et sembla?	2	0				ca	
a87e68210abf69b864018e6ab121b82eeb904fd5d1c0d1b2c5574bf6544a3ff2fca20f35e358b32efe1a1126acdffb62c59d3239deca8249b3b0eca322141f87	common_voice_ca_17375108.mp3	Casament de maig, curta durada.	3	0				ca	
a87e68210abf69b864018e6ab121b82eeb904fd5d1c0d1b2c5574bf6544a3ff2fca20f35e358b32efe1a1126acdffb62c59d3239deca8249b3b0eca322141f87	common_voice_ca_17375109.mp3	"Qualsevol altra tasca que li pugui encarregar el director de l'Oficina del Govern."	3	0				ca	
a87e68210abf69b864018e6ab121b82eeb904fd5d1c0d1b2c5574bf6544a3ff2fca20f35e358b32efe1a1126acdffb62c59d3239deca8249b3b0eca322141f87	common_voice_ca_17375110.mp3	"La cura que han tingut els americans a separar l'Església de l'Estat."	2	0				ca	
a87e68210abf69b864018e6ab121b82eeb904fd5d1c0d1b2c5574bf6544a3ff2fca20f35e358b32efe1a1126acdffb62c59d3239deca8249b3b0eca322141f87	common_voice_ca_17375111.mp3	"Els diners mal guanyats se'ls emporta el diable."	2	0				ca	
a87e68210abf69b864018e6ab121b82eeb904fd5d1c0d1b2c5574bf6544a3ff2fca20f35e358b32efe1a1126acdffb62c59d3239deca8249b3b0eca322141f87	common_voice_ca_17510807.mp3	No era la meva intenció.	2	0				ca	
a87e68210abf69b864018e6ab121b82eeb904fd5d1c0d1b2c5574bf6544a3ff2fca20f35e358b32efe1a1126acdffb62c59d3239deca8249b3b0eca322141f87	common_voice_ca_17510808.mp3	Emplena documentació relativa a procediments diagnòstics o terapèutics, interpretant els protocols establerts.	2	0				ca	
a87e68210abf69b864018e6ab121b82eeb904fd5d1c0d1b2c5574bf6544a3ff2fca20f35e358b32efe1a1126acdffb62c59d3239deca8249b3b0eca322141f87	common_voice_ca_17510811.mp3	"Digues-m'ho!"	2	1				ca	
a87e68210abf69b864018e6ab121b82eeb904fd5d1c0d1b2c5574bf6544a3ff2fca20f35e358b32efe1a1126acdffb62c59d3239deca8249b3b0eca322141f87	common_voice_ca_17510812.mp3	I ho era.	2	0				ca	
a87e68210abf69b864018e6ab121b82eeb904fd5d1c0d1b2c5574bf6544a3ff2fca20f35e358b32efe1a1126acdffb62c59d3239deca8249b3b0eca322141f87	common_voice_ca_17510813.mp3	No va servir de res.	2	0				ca	
a87e68210abf69b864018e6ab121b82eeb904fd5d1c0d1b2c5574bf6544a3ff2fca20f35e358b32efe1a1126acdffb62c59d3239deca8249b3b0eca322141f87	common_voice_ca_17510814.mp3	No diré mentides.	2	0				ca	
a87e68210abf69b864018e6ab121b82eeb904fd5d1c0d1b2c5574bf6544a3ff2fca20f35e358b32efe1a1126acdffb62c59d3239deca8249b3b0eca322141f87	common_voice_ca_17510815.mp3	"L'esmena ha estat rebutjada per deu vots a favor, cent deu en contra i onze abstencions."	2	0				ca	
a87e68210abf69b864018e6ab121b82eeb904fd5d1c0d1b2c5574bf6544a3ff2fca20f35e358b32efe1a1126acdffb62c59d3239deca8249b3b0eca322141f87	common_voice_ca_17510816.mp3	És mentida.	2	0				ca	
a87e68210abf69b864018e6ab121b82eeb904fd5d1c0d1b2c5574bf6544a3ff2fca20f35e358b32efe1a1126acdffb62c59d3239deca8249b3b0eca322141f87	common_voice_ca_17510817.mp3	Ho intentaré.	2	1				ca	
a87e68210abf69b864018e6ab121b82eeb904fd5d1c0d1b2c5574bf6544a3ff2fca20f35e358b32efe1a1126acdffb62c59d3239deca8249b3b0eca322141f87	common_voice_ca_17510818.mp3	Un cop acabat el debat, estem cridant a votació.	2	0				ca	
a87e68210abf69b864018e6ab121b82eeb904fd5d1c0d1b2c5574bf6544a3ff2fca20f35e358b32efe1a1126acdffb62c59d3239deca8249b3b0eca322141f87	common_voice_ca_17510819.mp3	"S'està morint."	2	0				ca	
a87e68210abf69b864018e6ab121b82eeb904fd5d1c0d1b2c5574bf6544a3ff2fca20f35e358b32efe1a1126acdffb62c59d3239deca8249b3b0eca322141f87	common_voice_ca_17510820.mp3	On està el problema?	2	0				ca	
b16e7b6c7e1fe360d95e5c51d8538b830225a167e1d83ebd09ab655b1ef8171ae4eb7f384b8a61b3bdf6ca0ec82965b61328a497eb42954814130dbf139a71e7	common_voice_ca_28012432.mp3	En una nota de premsa posterior, en López va anunciar un itinerari detallat.	2	0				ca	
b16e7b6c7e1fe360d95e5c51d8538b830225a167e1d83ebd09ab655b1ef8171ae4eb7f384b8a61b3bdf6ca0ec82965b61328a497eb42954814130dbf139a71e7	common_voice_ca_28012445.mp3	Així, Dionís no va desenvolupar un nou mètode de datar la Pasqua.	2	0				ca	
b16e7b6c7e1fe360d95e5c51d8538b830225a167e1d83ebd09ab655b1ef8171ae4eb7f384b8a61b3bdf6ca0ec82965b61328a497eb42954814130dbf139a71e7	common_voice_ca_28012456.mp3	Ens alegraria que fossin aquí.	2	0				ca	
b16e7b6c7e1fe360d95e5c51d8538b830225a167e1d83ebd09ab655b1ef8171ae4eb7f384b8a61b3bdf6ca0ec82965b61328a497eb42954814130dbf139a71e7	common_voice_ca_28012458.mp3	"El punt d'impacte es marca amb una pintura d'esprai amb un codi de color."	2	0				ca	
b16e7b6c7e1fe360d95e5c51d8538b830225a167e1d83ebd09ab655b1ef8171ae4eb7f384b8a61b3bdf6ca0ec82965b61328a497eb42954814130dbf139a71e7	common_voice_ca_28012459.mp3	Hi havia una pista de ball, una piscina coberta i molts vestidors.	2	0				ca	
b16e7b6c7e1fe360d95e5c51d8538b830225a167e1d83ebd09ab655b1ef8171ae4eb7f384b8a61b3bdf6ca0ec82965b61328a497eb42954814130dbf139a71e7	common_voice_ca_28012460.mp3	Les tempestes i els llampecs van ser vistos com a batalles divines.	2	0				ca	
b16e7b6c7e1fe360d95e5c51d8538b830225a167e1d83ebd09ab655b1ef8171ae4eb7f384b8a61b3bdf6ca0ec82965b61328a497eb42954814130dbf139a71e7	common_voice_ca_28012461.mp3	Anava al Calvin College de Michigan.	2	0				ca	
b16e7b6c7e1fe360d95e5c51d8538b830225a167e1d83ebd09ab655b1ef8171ae4eb7f384b8a61b3bdf6ca0ec82965b61328a497eb42954814130dbf139a71e7	common_voice_ca_28012476.mp3	"Els Instruments Legals Escocesos elaborats pel Govern d'Escòcia són una altre font de legislació."	2	0				ca	
b16e7b6c7e1fe360d95e5c51d8538b830225a167e1d83ebd09ab655b1ef8171ae4eb7f384b8a61b3bdf6ca0ec82965b61328a497eb42954814130dbf139a71e7	common_voice_ca_28012477.mp3	No hi ha cap esment de cap altre comportament que pogués prohibir aquesta estrofa.	2	0				ca	
b16e7b6c7e1fe360d95e5c51d8538b830225a167e1d83ebd09ab655b1ef8171ae4eb7f384b8a61b3bdf6ca0ec82965b61328a497eb42954814130dbf139a71e7	common_voice_ca_28012478.mp3	"Puc veure ""An Innocent Affair"" al cinema més proper."	2	0				ca	
b16e7b6c7e1fe360d95e5c51d8538b830225a167e1d83ebd09ab655b1ef8171ae4eb7f384b8a61b3bdf6ca0ec82965b61328a497eb42954814130dbf139a71e7	common_voice_ca_28012479.mp3	"""Amb prou feines sé com era, governador"", va dir Phil, pensatiu."	2	0				ca	
b16e7b6c7e1fe360d95e5c51d8538b830225a167e1d83ebd09ab655b1ef8171ae4eb7f384b8a61b3bdf6ca0ec82965b61328a497eb42954814130dbf139a71e7	common_voice_ca_28012480.mp3	La gent camina per la vorera mentre passa per moltes botigues.	2	0				ca	
b16e7b6c7e1fe360d95e5c51d8538b830225a167e1d83ebd09ab655b1ef8171ae4eb7f384b8a61b3bdf6ca0ec82965b61328a497eb42954814130dbf139a71e7	common_voice_ca_28012501.mp3	La ciutat lliure del districte Landau està envoltada pel districte.	2	0				ca	
b16e7b6c7e1fe360d95e5c51d8538b830225a167e1d83ebd09ab655b1ef8171ae4eb7f384b8a61b3bdf6ca0ec82965b61328a497eb42954814130dbf139a71e7	common_voice_ca_28012502.mp3	"De manera similar, la liaison francesa no s'aplica a pausa."	2	0				ca	
b16e7b6c7e1fe360d95e5c51d8538b830225a167e1d83ebd09ab655b1ef8171ae4eb7f384b8a61b3bdf6ca0ec82965b61328a497eb42954814130dbf139a71e7	common_voice_ca_28012504.mp3	"L'àlbum inclou el primer enregistrament comercialitzat de ""Memorial""."	2	0				ca	
b16e7b6c7e1fe360d95e5c51d8538b830225a167e1d83ebd09ab655b1ef8171ae4eb7f384b8a61b3bdf6ca0ec82965b61328a497eb42954814130dbf139a71e7	common_voice_ca_28012505.mp3	Els llocs seleccionats solen ser poc coneguts i principalment no comercials.	2	0				ca	
b16e7b6c7e1fe360d95e5c51d8538b830225a167e1d83ebd09ab655b1ef8171ae4eb7f384b8a61b3bdf6ca0ec82965b61328a497eb42954814130dbf139a71e7	common_voice_ca_28012506.mp3	La disponibilitat de les demostracions varia segons els formats.	2	0				ca	
b16e7b6c7e1fe360d95e5c51d8538b830225a167e1d83ebd09ab655b1ef8171ae4eb7f384b8a61b3bdf6ca0ec82965b61328a497eb42954814130dbf139a71e7	common_voice_ca_28012511.mp3	"S'han suggerit diverses motivacions per l'acte."	2	0				ca	
b16e7b6c7e1fe360d95e5c51d8538b830225a167e1d83ebd09ab655b1ef8171ae4eb7f384b8a61b3bdf6ca0ec82965b61328a497eb42954814130dbf139a71e7	common_voice_ca_28012513.mp3	El seu estil incorpora elements del jazz progressiu i contemporani, jazz llatí i jazz fusió.	2	0				ca	
b16e7b6c7e1fe360d95e5c51d8538b830225a167e1d83ebd09ab655b1ef8171ae4eb7f384b8a61b3bdf6ca0ec82965b61328a497eb42954814130dbf139a71e7	common_voice_ca_28012514.mp3	La Universitat està presidida pel doctor Vullnet Ameti.	2	0				ca	
b16e7b6c7e1fe360d95e5c51d8538b830225a167e1d83ebd09ab655b1ef8171ae4eb7f384b8a61b3bdf6ca0ec82965b61328a497eb42954814130dbf139a71e7	common_voice_ca_28012515.mp3	"El tercer era una minoria d'homes joves principalment de Virgínia Occidental."	2	0				ca	
b34b4b625c22c74bebed74a1d5ef57aad9be0eb577f59c0000b126cbc215960f4c3a1ecfc4b15413fa23050272cacfd5c668d2538b369e8e1a941b5e2e975a21	common_voice_ca_24682867.mp3	"S'alimenta dels animals perduts ferits pels caçadors o que no van ser trobats per aquests."	2	0				ca	
b34b4b625c22c74bebed74a1d5ef57aad9be0eb577f59c0000b126cbc215960f4c3a1ecfc4b15413fa23050272cacfd5c668d2538b369e8e1a941b5e2e975a21	common_voice_ca_24682868.mp3	És un tret comú de molts animals superiors.	2	0				ca	
b34b4b625c22c74bebed74a1d5ef57aad9be0eb577f59c0000b126cbc215960f4c3a1ecfc4b15413fa23050272cacfd5c668d2538b369e8e1a941b5e2e975a21	common_voice_ca_24682869.mp3	"L'atmosfera lliure no és turbulenta o només ho és de forma intermitent."	2	1				ca	
b34b4b625c22c74bebed74a1d5ef57aad9be0eb577f59c0000b126cbc215960f4c3a1ecfc4b15413fa23050272cacfd5c668d2538b369e8e1a941b5e2e975a21	common_voice_ca_24682870.mp3	Ofeguen les penes en alcohol.	2	0				ca	
b34b4b625c22c74bebed74a1d5ef57aad9be0eb577f59c0000b126cbc215960f4c3a1ecfc4b15413fa23050272cacfd5c668d2538b369e8e1a941b5e2e975a21	common_voice_ca_24682871.mp3	"Havia fundat l'Acadèmia dels humoristes."	2	0				ca	
b34b4b625c22c74bebed74a1d5ef57aad9be0eb577f59c0000b126cbc215960f4c3a1ecfc4b15413fa23050272cacfd5c668d2538b369e8e1a941b5e2e975a21	common_voice_ca_24763219.mp3	"També s'informa que el tren s'ha quedat bloquejat a causa d'una tempesta de neu."	2	1				ca	
b34b4b625c22c74bebed74a1d5ef57aad9be0eb577f59c0000b126cbc215960f4c3a1ecfc4b15413fa23050272cacfd5c668d2538b369e8e1a941b5e2e975a21	common_voice_ca_24763220.mp3	Es conserva al Museu Puixkin de Moscou.	2	0				ca	
b34b4b625c22c74bebed74a1d5ef57aad9be0eb577f59c0000b126cbc215960f4c3a1ecfc4b15413fa23050272cacfd5c668d2538b369e8e1a941b5e2e975a21	common_voice_ca_24763221.mp3	Durant la infància va morir sa mare i el pare es va tornar a casar.	2	0				ca	
b34b4b625c22c74bebed74a1d5ef57aad9be0eb577f59c0000b126cbc215960f4c3a1ecfc4b15413fa23050272cacfd5c668d2538b369e8e1a941b5e2e975a21	common_voice_ca_24763222.mp3	En la seva ciutat de Siena li posaren el seu nom a un carrer.	2	0				ca	
b34b4b625c22c74bebed74a1d5ef57aad9be0eb577f59c0000b126cbc215960f4c3a1ecfc4b15413fa23050272cacfd5c668d2538b369e8e1a941b5e2e975a21	common_voice_ca_24763223.mp3	El jugador amb la carta més propera al mes de gener, comença.	2	0				ca	
b34b4b625c22c74bebed74a1d5ef57aad9be0eb577f59c0000b126cbc215960f4c3a1ecfc4b15413fa23050272cacfd5c668d2538b369e8e1a941b5e2e975a21	common_voice_ca_24887914.mp3	"Abraham els ha descrit com a ""una consciència de grup de la dimensió no física""."	2	0				ca	
b34b4b625c22c74bebed74a1d5ef57aad9be0eb577f59c0000b126cbc215960f4c3a1ecfc4b15413fa23050272cacfd5c668d2538b369e8e1a941b5e2e975a21	common_voice_ca_24887915.mp3	Calcis es va fer membre posteriorment de les dues Lligues de Delos.	2	0				ca	
b34b4b625c22c74bebed74a1d5ef57aad9be0eb577f59c0000b126cbc215960f4c3a1ecfc4b15413fa23050272cacfd5c668d2538b369e8e1a941b5e2e975a21	common_voice_ca_24887916.mp3	El seu retrat es pot veure al club Players de Nova York.	2	0				ca	
b34b4b625c22c74bebed74a1d5ef57aad9be0eb577f59c0000b126cbc215960f4c3a1ecfc4b15413fa23050272cacfd5c668d2538b369e8e1a941b5e2e975a21	common_voice_ca_24887917.mp3	Fins a cert punt, una casa també és un aspecte de la infraestructura personal.	2	1				ca	
b34b4b625c22c74bebed74a1d5ef57aad9be0eb577f59c0000b126cbc215960f4c3a1ecfc4b15413fa23050272cacfd5c668d2538b369e8e1a941b5e2e975a21	common_voice_ca_24905840.mp3	Es va crear un pla per restaurar les instal·lacions al campament.	2	0				ca	
b34b4b625c22c74bebed74a1d5ef57aad9be0eb577f59c0000b126cbc215960f4c3a1ecfc4b15413fa23050272cacfd5c668d2538b369e8e1a941b5e2e975a21	common_voice_ca_24905843.mp3	La llengua dominant és el cuyonon, mentre que les llengües bisaya i el tagal són segones llengües.	2	0				ca	
b34b4b625c22c74bebed74a1d5ef57aad9be0eb577f59c0000b126cbc215960f4c3a1ecfc4b15413fa23050272cacfd5c668d2538b369e8e1a941b5e2e975a21	common_voice_ca_24905844.mp3	En aquest article hi ha informació sobre el districte de Kanpur Nagar.	2	0				ca	
b34b4b625c22c74bebed74a1d5ef57aad9be0eb577f59c0000b126cbc215960f4c3a1ecfc4b15413fa23050272cacfd5c668d2538b369e8e1a941b5e2e975a21	common_voice_ca_24905846.mp3	"Pennsylvania és l'estat dels Estats Units que rep més quantitat de pluja àcida."	2	0				ca	
b34b4b625c22c74bebed74a1d5ef57aad9be0eb577f59c0000b126cbc215960f4c3a1ecfc4b15413fa23050272cacfd5c668d2538b369e8e1a941b5e2e975a21	common_voice_ca_24905847.mp3	"La columna ha estat la font de moltes retractacions per ""Temps""."	2	0				ca	
b34b4b625c22c74bebed74a1d5ef57aad9be0eb577f59c0000b126cbc215960f4c3a1ecfc4b15413fa23050272cacfd5c668d2538b369e8e1a941b5e2e975a21	common_voice_ca_25075157.mp3	Dahlia estava al saló.	2	0				ca	
b34b4b625c22c74bebed74a1d5ef57aad9be0eb577f59c0000b126cbc215960f4c3a1ecfc4b15413fa23050272cacfd5c668d2538b369e8e1a941b5e2e975a21	common_voice_ca_25075161.mp3	"Aquests efectes secundaris es poden prevenir principalment amb l'administració d'una prova adequada."	2	0				ca	
b8f58926198faa6d8a6c90e3a6c8a83a262a6edd5abafaca0961743011d8bc083f060fc505feeae3a1c76b3b0367053204cb18036596914f13de228e92b32f87	common_voice_ca_17583257.mp3	"Els aspirants que resulten seleccionats se sotmetran al règim d'incompatibilitats vigent."	2	0				ca	
b8f58926198faa6d8a6c90e3a6c8a83a262a6edd5abafaca0961743011d8bc083f060fc505feeae3a1c76b3b0367053204cb18036596914f13de228e92b32f87	common_voice_ca_17583258.mp3	La seua tasca començava amb els preparatius, ja que era a sa casa on els dansers es reunien i triaven el Rei Moro.	2	0				ca	
b8f58926198faa6d8a6c90e3a6c8a83a262a6edd5abafaca0961743011d8bc083f060fc505feeae3a1c76b3b0367053204cb18036596914f13de228e92b32f87	common_voice_ca_17588384.mp3	Avui, doncs, presentem una versió nova del nostre robot del Telegram.	2	0				ca	
b8f58926198faa6d8a6c90e3a6c8a83a262a6edd5abafaca0961743011d8bc083f060fc505feeae3a1c76b3b0367053204cb18036596914f13de228e92b32f87	common_voice_ca_17642417.mp3	"Quin canvi tan ràpid era aquell, des de l'adoració idolàtrica a una repulsió instintiva?"	2	1				ca	
b8f58926198faa6d8a6c90e3a6c8a83a262a6edd5abafaca0961743011d8bc083f060fc505feeae3a1c76b3b0367053204cb18036596914f13de228e92b32f87	common_voice_ca_17642418.mp3	Per ferrer, un home fet, i per lletres, el noiet.	2	0				ca	
